"","original_family","original_name","name_in_Flora","original_ID","final_family","scientificName","taxonID","vernacular_names","notes","tax_notes","notes_fam","nombre","establishmentMeans","occurrenceRemarks","location","lifeForm","vegetationType","habitat"
"532","Ochnaceae","Quiina glaziovii Engl.","Quiina glaziovii Engl.",596934,"Quiinaceae","Quiina glaziovii Engl.",596934,NA,"LFB","name ok","family changed","Quiina glaziovii","NATIVA","Endemica/Mata Atlântica","BR-PR-BR-SC-BR-MG-BR-SP-BR-RJ-BR-BA","Árvore","Floresta Estacional Decidual",NA
"533","Apocynaceae","Rauvolfia bahiensis A.DC.","Rauvolfia bahiensis A.DC.",4841,"Apocynaceae","Rauvolfia bahiensis A.DC.",4841,"pau-de-cachimbo-branco-PORTUGUES-nordeste/pau-de-leite-PORTUGUES-nordeste","LFB","name ok","","Rauvolfia bahiensis","NATIVA","Endemica/Mata Atlântica","BR-BA","Árvore","Floresta Ombrófila (= Floresta Pluvial)","Terrícola"
"534","Apocynaceae","Rauvolfia grandiflora Mart. ex A.DC.","Rauvolfia grandiflora Mart. ex A.DC.",4843,"Apocynaceae","Rauvolfia grandiflora Mart. ex A.DC.",4843,NA,"LFB","name ok","","Rauvolfia grandiflora","NATIVA","Endemica/Mata Atlântica","BR-MG-BR-CE-BR-RJ-BR-ES-BR-PE-BR-BA-BR-AL","Arbusto-Árvore","Floresta Ombrófila (= Floresta Pluvial)","Terrícola"
"535","Rubiaceae","Remijia ferruginea DC.","Remijia ferruginea (A.St.-Hil.) DC.",26089,"Rubiaceae","Remijia ferruginea (A.St.-Hil.) DC.",26089,NA,"LFB","name ok","","Remijia ferruginea","NATIVA","Endemica/Amazônia-Endemica/Cerrado-Endemica/Mata Atlântica","BR-BA-BR-ES-BR-MG-BR-MT-BR-MS","Arbusto","Carrasco-Cerrado (lato sensu)-Vegetação Sobre Afloramentos Rochosos","Rupícola-Terrícola"
"536","Rubiaceae","Remijia firmula Wedd.","Remijia firmula (Mart.) Wedd.",24586,"Rubiaceae","Remijia firmula (Mart.) Wedd.",24586,NA,"LFB","name ok","","Remijia firmula","NATIVA","Endemica/Amazônia","BR-RO-BR-AM-BR-AC-BR-MT-BR-MS","Árvore","Campinarana-Savana Amazônica","Terrícola"
"537","Lauraceae","Rhodostemonodaphne macrocalyx (Meisn.) Rohwer ex Madriñán","Rhodostemonodaphne macrocalyx (Meisn.) Rohwer ex Madriñán",8531,"Lauraceae","Rhodostemonodaphne macrocalyx (Meisn.) Rohwer ex Madriñán",8531,"canela cedro-PORTUGUES-sudeste","LFB","name ok","","Rhodostemonodaphne macrocalyx","NATIVA","Endemica/Caatinga-Endemica/Mata Atlântica","BR-SP-BR-RJ-BR-ES-BR-PR-BR-PI-BR-BA","Árvore","Floresta Ciliar ou Galeria-Floresta Ombrófila (= Floresta Pluvial)-Restinga","Terrícola"
"538","Rubiaceae","Rudgea jasminoides (Cham.) Müll.Arg.","Rudgea jasminoides (Cham.) Müll.Arg.",14257,"Rubiaceae","Rudgea jasminoides (Cham.) Müll.Arg.",14257,"jasmin-do-mato-PORTUGUES-São Paulo/café-do-mato-PORTUGUES-São Paulo/casca d'anta-PORTUGUES-São Paulo/pasto d'anta-PORTUGUES-São Paulo/pimenteira-de-folha-larga-PORTUGUES-São Paulo","LFB","name ok","","Rudgea jasminoides","NATIVA","Não endemica/Mata Atlântica","BR-SP-BR-RJ-BR-MG-BR-SC-BR-PR","Arbusto-Árvore","Floresta Ciliar ou Galeria-Floresta Estacional Semidecidual-Floresta Ombrófila (= Floresta Pluvial)-Floresta Ombrófila Mista-Restinga","Terrícola"
"539","Rubiaceae","Rudgea longiflora Benth.","Rudgea longiflora Benth.",39297,"Rubiaceae","Rudgea longiflora Benth.",39297,"jasmin-PORTUGUES-Mato Grosso/sucena-do-brejo-PORTUGUES-Mato Grosso","LFB","name ok","","Rudgea longiflora","NATIVA","Endemica/Amazônia-Endemica/Caatinga-Endemica/Cerrado","BR-TO-BR-MA-BR-RR-BR-RO-BR-PA-BR-MT-BR-GO","Arbusto-Árvore","Cerrado (lato sensu)-Floresta Ciliar ou Galeria-Floresta de Terra Firme-Floresta de Várzea","Terrícola"
"540","Rubiaceae","Rustia formosa (Cham. & Schltdl. ex DC.) Klotzsch","Rustia formosa (Cham. & Schltdl.) Klotzsch",14275,"Rubiaceae","Rustia formosa (Cham. & Schltdl.) Klotzsch",14275,"caapeba-PORTUGUES-Minas Gerais/sobrasil-PORTUGUES-São Paulo","LFB","name ok","","Rustia formosa","NATIVA","Endemica/Cerrado-Endemica/Mata Atlântica","BR-ES-BR-SP-BR-RJ-BR-MG-BR-GO-BR-DF","Árvore","Cerrado (lato sensu)-Floresta Ciliar ou Galeria-Floresta Ombrófila (= Floresta Pluvial)-Restinga","Terrícola"
"541","Celastraceae","Salacia grandifolia (Mart.) G.Don","Salacia grandifolia (Mart.) G.Don",6792,"Celastraceae","Salacia grandifolia (Mart.) G.Don",6792,NA,"LFB","name ok","","Salacia grandifolia","NATIVA","Endemica/Mata Atlântica","BR-SP-BR-RJ-BR-ES-BR-BA","Arbusto-Árvore","Floresta Ombrófila (= Floresta Pluvial)","Terrícola"
"542","Araliaceae","Schefflera angustissima (Marchal) Frodin","Schefflera angustissima (Marchal) Frodin",5134,"Araliaceae","Schefflera angustissima (Marchal) Frodin",5134,NA,"LFB","name ok","","Schefflera angustissima","NATIVA","Endemica/Mata Atlântica","BR-BA-BR-SP-BR-RJ-BR-MG-BR-SC-BR-PR","Árvore","Floresta Ombrófila (= Floresta Pluvial)-Restinga","Terrícola"
"543","Araliaceae","Schefflera macrocarpa (Cham. & Schltdl.) Frodin","Schefflera macrocarpa (Cham. & Schltdl.) Frodin",15659,"Araliaceae","Schefflera macrocarpa (Cham. & Schltdl.) Frodin",15659,NA,"LFB","name ok","","Schefflera macrocarpa","NATIVA","Endemica/Caatinga-Endemica/Cerrado-Endemica/Mata Atlântica","BR-SP-BR-MG-BR-BA-BR-MT-BR-GO-BR-DF","Arbusto-Árvore","Campo rupestre-Cerrado (lato sensu)","Rupícola-Terrícola"
"544","Araliaceae","Schefflera vinosa (Cham. & Schltdl.) Frodin & Fiaschi","Schefflera vinosa (Cham. & Schltdl.) Frodin & Fiaschi",15661,"Araliaceae","Schefflera vinosa (Cham. & Schltdl.) Frodin & Fiaschi",15661,NA,"LFB","name ok","","Schefflera vinosa","NATIVA","Endemica/Caatinga-Endemica/Cerrado-Endemica/Mata Atlântica","BR-SP-BR-MG-BR-PR-BR-BA-BR-MS-BR-GO-BR-DF","Arbusto","Campo rupestre-Cerrado (lato sensu)","Terrícola"
"545","Humiriaceae","Schistostemon macrophyllum (Benth.) Cuatrec.","Schistostemon macrophyllum (Benth.) Cuatrec.",84100,"Humiriaceae","Schistostemon macrophyllum (Benth.) Cuatrec.",84100,NA,"LFB","name ok","","Schistostemon macrophyllum","NATIVA","Endemica/Amazônia","BR-AM","Arbusto-Árvore","Floresta de Várzea","Terrícola"
"546","Rubiaceae","Schizocalyx cuspidatus (A.St.-Hil.) Kainul. & B.Bremer","Schizocalyx cuspidatus (A.St.-Hil.) Kainul. & B. Bremer",128994,"Rubiaceae","Schizocalyx cuspidatus (A.St.-Hil.) Kainul. & B. Bremer",128994,"quinza-cinzena-PORTUGUES-Rio de Janeiro/quina-do-mato-PORTUGUES-Rio de Janeiro","LFB","name ok","","Schizocalyx cuspidatus","NATIVA","Endemica/Cerrado-Endemica/Mata Atlântica","BR-MS-BR-MT-BR-ES-BR-MG-BR-SP-BR-RJ-BR-GO-BR-BA","Arbusto-Árvore","Floresta Estacional Semidecidual-Floresta Ombrófila (= Floresta Pluvial)","Terrícola"
"547","Marcgraviaceae","Schwartzia adamantium (Cambess.) Bedell ex Gir.-Cañas","Schwartzia adamantium (Cambess.) Bedell ex Gir.-Cañas",103322,"Marcgraviaceae","Schwartzia adamantium (Cambess.) Bedell ex Gir.-Cañas",103322,NA,"LFB","name ok","","Schwartzia adamantium","NATIVA","Endemica/Cerrado","BR-MG-BR-BA-BR-TO-BR-GO-BR-DF","Arbusto-Árvore","Campo rupestre-Floresta Ciliar ou Galeria-Vegetação Sobre Afloramentos Rochosos","Terrícola"
"548","Malvaceae","Scleronema micranthum (Ducke) Ducke","Scleronema micranthum (Ducke) Ducke",84926,"Malvaceae","Scleronema micranthum (Ducke) Ducke",84926,"cardeiro-PORTUGUES-norte","LFB","name ok","","Scleronema micranthum","NATIVA","Não endemica/Amazônia","BR-PA-BR-AM","Árvore","Floresta de Terra Firme","Terrícola"
"549","Euphorbiaceae","Sebastiania macrocarpa Müll.Arg.","Sebastiania macrocarpa Müll.Arg.",25571,"Euphorbiaceae","Sebastiania macrocarpa Müll.Arg.",25571,"Pau-de-leite-PORTUGUES-NE/Pau-leite-PORTUGUES-NE/Purga-de-leite-PORTUGUES-NE/Sapinho-PORTUGUES-NE","LFB","name ok","","Sebastiania macrocarpa","NATIVA","Endemica/Caatinga","BR-RN-BR-PE-BR-CE-BR-BA","Arbusto-Árvore","Caatinga (stricto sensu)","Terrícola"
"550","Euphorbiaceae","Senefeldera verticillata (Vell.) Croizat","Senefeldera verticillata (Vell.) Croizat",17685,"Euphorbiaceae","Senefeldera verticillata (Vell.) Croizat",17685,"'osso de burro'-PORTUGUES-Sudeste/RJ/'pau marfim'-PORTUGUES-Nordeste/BA/'marfim verdadeiro'-PORTUGUES-Nordeste/AL/'sucanga'-PORTUGUES-Sudeste/ES","LFB","name ok","","Senefeldera verticillata","NATIVA","Endemica/Mata Atlântica","BR-ES-BR-PE-BR-AL-BR-SP-BR-RJ-BR-BA-BR-MG","Árvore","Floresta Ombrófila (= Floresta Pluvial)","Terrícola"
"551","Fabaceae","Senegalia bahiensis (Benth.) Seigler & Ebinger","Senegalia bahiensis (Benth.) Seigler & Ebinger",100998,"Fabaceae","Senegalia bahiensis (Benth.) Seigler & Ebinger",100998,"calumbi-PORTUGUES-semi-árido","LFB","name ok","","Senegalia bahiensis","NATIVA","Endemica/Caatinga-Endemica/Mata Atlântica","BR-RJ-BR-MG-BR-SE-BR-RN-BR-PI-BR-PE-BR-PB-BR-BA-BR-AL","Arbusto-Árvore","Caatinga (stricto sensu)-Floresta Ombrófila (= Floresta Pluvial)-Restinga","Terrícola"
"552","Fabaceae","Senegalia lasiophylla (Benth.) Seigler & Ebinger","Senegalia lasiophylla (Benth.) Seigler & Ebinger",101023,"Fabaceae","Senegalia lasiophylla (Benth.) Seigler & Ebinger",101023,NA,"LFB","name ok","","Senegalia lasiophylla","NATIVA","Endemica/Mata Atlântica","BR-MG","Arbusto-Árvore","Floresta Estacional Semidecidual","Terrícola"
"553","Fabaceae","Senegalia paganuccii Seigler, Ebinger & P.G.Ribeiro","Senegalia paganuccii Seigler, Ebinger & Ribeiro",128941,"Fabaceae","Senegalia paganuccii Seigler, Ebinger & Ribeiro",128941,NA,"LFB","name ok","","Senegalia paganuccii","NATIVA","Endemica/Caatinga-Endemica/Cerrado","BR-MG-BR-PI-BR-BA","Arbusto-Árvore","Caatinga (stricto sensu)-Cerrado (lato sensu)-Floresta Estacional Decidual","Terrícola"
"554","Fabaceae","Senna acuruensis (Benth.) H.S.Irwin & Barneby","Senna acuruensis (Benth.) H.S.Irwin & Barneby",28174,"Fabaceae","Senna acuruensis (Benth.) H.S.Irwin & Barneby",28174,NA,"LFB","name ok","","Senna acuruensis","NATIVA","Endemica/Caatinga","BR-PE-BR-BA","Arbusto-Árvore","Caatinga (stricto sensu)","Terrícola"
"555","Fabaceae","Senna aversiflora (Herb.) H.S.Irwin & Barneby","Senna aversiflora (Herb.) H.S.Irwin & Barneby",19054,"Fabaceae","Senna aversiflora (Herb.) H.S.Irwin & Barneby",19054,NA,"LFB","name ok","","Senna aversiflora","NATIVA","Endemica/Caatinga","BR-PE-BR-PB-BR-BA","Arbusto","Caatinga (stricto sensu)","Terrícola"
"556","Fabaceae","Senna cana (Nees & Mart.) H.S.Irwin & Barneby","Senna cana (Nees & Mart.) H.S.Irwin & Barneby",78775,"Fabaceae","Senna cana (Nees & Mart.) H.S.Irwin & Barneby",78775,NA,"LFB","name ok","","Senna cana","NATIVA","Não endemica/Amazônia-Não endemica/Caatinga-Não endemica/Cerrado-Não endemica/Mata Atlântica","BR-SP-BR-MG-BR-ES-BR-SE-BR-PI-BR-PE-BR-PB-BR-MA-BR-BA-BR-AL-BR-PA-BR-GO-BR-DF","Arbusto","Área Antrópica-Caatinga (stricto sensu)-Campo rupestre-Cerrado (lato sensu)-Floresta Estacional Semidecidual-Vegetação Sobre Afloramentos Rochosos","Rupícola"
"557","Fabaceae","Senna cearensis Afr.Fern.","Senna cearensis Afr.Fern.",28185,"Fabaceae","Senna cearensis Afr.Fern.",28185,NA,"LFB","name ok","","Senna cearensis","NATIVA","Endemica/Caatinga","BR-PI-BR-PE-BR-PB-BR-CE-BR-BA","Arbusto-Árvore","Caatinga (stricto sensu)","Terrícola"
"558","Fabaceae","Senna trachypus (Benth.) H.S.Irwin & Barneby","Senna trachypus (Benth.) H.S.Irwin & Barneby",28237,"Fabaceae","Senna trachypus (Benth.) H.S.Irwin & Barneby",28237,NA,"LFB","name ok","","Senna trachypus","NATIVA","Endemica/Caatinga-Endemica/Cerrado","BR-PB-BR-MA-BR-CE-BR-BA-BR-SP-BR-MG-BR-RN-BR-PI-BR-PE","Arbusto-Árvore","Caatinga (stricto sensu)-Cerrado (lato sensu)","Terrícola"
"559","Simaroubaceae","Simaba ferruginea A.St.-Hil.","Simaba ferruginea A.St.-Hil.",1342,"Simaroubaceae","Homalolepis ferruginea (A.St.-Hil.) Devecchi & Pirani",604263,NA,"LFB","synonym","","Homalolepis ferruginea","NATIVA","Endemica/Cerrado","BR-MG-BR-GO-BR-MS-BR-MT-BR-PI-BR-MA-BR-BA-BR-TO","Árvore","Cerrado (lato sensu)","Terrícola"
"560","Rubiaceae","Simira glaziovii (K.Schum.) Steyerm.","Simira glaziovii (K.Schum.) Steyerm.",14290,"Rubiaceae","Simira glaziovii (K.Schum.) Steyerm.",14290,NA,"LFB","name ok","","Simira glaziovii","NATIVA","Endemica/Mata Atlântica","BR-RJ-BR-MG-BR-ES-BR-BA","Árvore","Floresta Ombrófila (= Floresta Pluvial)","Terrícola"
"561","Rubiaceae","Simira sampaioana (Standl.) Steyerm.","Simira sampaioana (Standl.) Steyerm.",14294,"Rubiaceae","Simira sampaioana (Standl.) Steyerm.",14294,NA,"LFB","name ok","","Simira sampaioana","NATIVA","Endemica/Cerrado-Endemica/Mata Atlântica","BR-RJ-BR-SP-BR-MG-BR-ES-BR-SC","Árvore","Floresta Estacional Semidecidual","Terrícola"
"562","Siparunaceae","Siparuna glycycarpa (Ducke) S.S.Renner & Hausner","Siparuna glycycarpa (Ducke) Renner & Hausner",14547,"Siparunaceae","Siparuna glycycarpa (Ducke) Renner & Hausner",14547,"quariquarana-PORTUGUES-Região Norte/aquariquara-de-igapó-PORTUGUES-Acre/caa-pitiú-PORTUGUES-Região Norte/erva-de-rato-PORTUGUES-Região Norte/itaúba-preta-PORTUGUES-Região Norte/quariquara-preta-PORTUGUES-Região Norte","LFB","name ok","","Siparuna glycycarpa","NATIVA","Endemica/Amazônia-Endemica/Mata Atlântica","BR-BA-BR-PA-BR-AM-BR-AC-BR-MT","Árvore","Floresta Ombrófila (= Floresta Pluvial)","Terrícola"
"563","Myrtaceae","Siphoneugena crassifolia (DC.) Proença & Sobral","Siphoneugena crassifolia (DC.) Proença & Sobral",126962,"Myrtaceae","Siphoneugena crassifolia (DC.) Proença & Sobral",126962,NA,"LFB","name ok","","Siphoneugena crassifolia","NATIVA","Endemica/Cerrado-Endemica/Mata Atlântica","BR-SP-BR-MG-BR-ES-BR-PR","Árvore","Campo rupestre-Cerrado (lato sensu)-Floresta Estacional Semidecidual","Terrícola"
"564","Solanaceae","Solanum argenteum Dunal ex Poir.","Solanum argenteum Dunal",14731,"Solanaceae","Solanum argenteum Dunal",14731,NA,"LFB","name ok","","Solanum argenteum","NATIVA","Endemica/Cerrado-Endemica/Mata Atlântica","BR-DF-BR-SP-BR-RJ-BR-MG-BR-ES-BR-PR-BR-GO","Arbusto-Árvore","Floresta Estacional Semidecidual-Floresta Ombrófila (= Floresta Pluvial)","Terrícola"
"565","Solanaceae","Solanum cernuum Vell.","Solanum cernuum Vell.",14746,"Solanaceae","Solanum cernuum Vell.",14746,NA,"LFB","name ok","","Solanum cernuum","NATIVA","Endemica/Cerrado-Endemica/Mata Atlântica","BR-SP-BR-RJ-BR-MG-BR-ES-BR-BA-BR-GO-BR-DF","Arbusto-Árvore","Área Antrópica-Floresta Estacional Semidecidual-Floresta Ombrófila (= Floresta Pluvial)-Floresta Ombrófila Mista","Terrícola"
"566","Solanaceae","Solanum granulosoleprosum Dunal","Solanum granulosoleprosum Dunal",14775,"Solanaceae","Solanum granulosoleprosum Dunal",14775,NA,"LFB","name ok","","Solanum granulosoleprosum","NATIVA","Não endemica/Cerrado-Não endemica/Mata Atlântica","BR-SP-BR-RJ-BR-MG-BR-ES-BR-SC-BR-RS-BR-PR-BR-BA-BR-MS-BR-GO-BR-DF","Árvore","Área Antrópica-Cerrado (lato sensu)-Floresta Ciliar ou Galeria-Floresta Estacional Decidual-Floresta Estacional Semidecidual-Floresta Ombrófila (= Floresta Pluvial)-Floresta Ombrófila Mista","Terrícola"
"567","Solanaceae","Solanum lacerdae Dusén","Solanum lacerdae Dusén",14796,"Solanaceae","Solanum lacerdae Dusén",14796,NA,"LFB","name ok","","Solanum lacerdae","NATIVA","Endemica/Mata Atlântica","BR-SP-BR-RJ-BR-MG-BR-SC-BR-PR","Arbusto-Árvore","Floresta Ombrófila (= Floresta Pluvial)-Floresta Ombrófila Mista","Terrícola"
"568","Solanaceae","Solanum leptostachys Dunal","Solanum leptostachys Dunal",14801,"Solanaceae","Solanum leptostachys Dunal",14801,NA,"LFB","name ok","","Solanum leptostachys","NATIVA","Endemica/Mata Atlântica","BR-SP-BR-RJ-BR-MG-BR-ES-BR-BA","Arbusto-Árvore","Cerrado (lato sensu)-Floresta Estacional Semidecidual-Floresta Ombrófila (= Floresta Pluvial)","Terrícola"
"569","Solanaceae","Solanum oocarpum Sendtn.","Solanum oocarpum Sendtn.",14816,"Solanaceae","Solanum oocarpum Sendtn.",14816,NA,"LFB","name ok","","Solanum oocarpum","NATIVA","Endemica/Cerrado-Endemica/Mata Atlântica","BR-SP-BR-MG-BR-MT-BR-MS-BR-GO-BR-DF","Arbusto-Árvore","Floresta Estacional Semidecidual","Terrícola"
"570","Solanaceae","Solanum pabstii L.B.Sm. & Downs","Solanum pabstii L.B.Sm. & Downs",14817,"Solanaceae","Solanum pabstii L.B.Sm. & Downs",14817,NA,"LFB","name ok","","Solanum pabstii","NATIVA","Endemica/Mata Atlântica","BR-SP-BR-SC-BR-RS-BR-PR","Árvore","Floresta Estacional Decidual-Floresta Ombrófila Mista","Terrícola"
"571","Solanaceae","Solanum paranense Dusén","Solanum paranense Dusén",14824,"Solanaceae","Solanum paranense Dusén",14824,NA,"LFB","name ok","","Solanum paranense","NATIVA","Endemica/Mata Atlântica","BR-SC-BR-RS-BR-PR","Arbusto-Árvore","Floresta Ombrófila (= Floresta Pluvial)-Floresta Ombrófila Mista","Terrícola"
"572","Solanaceae","Solanum rufescens Sendtn.","Solanum rufescens Sendtn.",14846,"Solanaceae","Solanum rufescens Sendtn.",14846,NA,"LFB","name ok","","Solanum rufescens","NATIVA","Endemica/Mata Atlântica","BR-SP-BR-RJ-BR-MG-BR-ES-BR-SC-BR-PR","Arbusto","Floresta Estacional Semidecidual-Floresta Ombrófila (= Floresta Pluvial)","Terrícola"
"573","Solanaceae","Solanum stipulaceum Willd. ex Roem. & Schult.","Solanum stipulaceum Willd. ex Roem. & Schult.",14865,"Solanaceae","Solanum stipulaceum Willd. ex Roem. & Schult.",14865,NA,"LFB","name ok","","Solanum stipulaceum","NATIVA","Endemica/Caatinga-Endemica/Cerrado-Endemica/Mata Atlântica","BR-MG-BR-SE-BR-PI-BR-PE-BR-PB-BR-CE-BR-BA-BR-AL-BR-GO","Arbusto-Árvore","Caatinga (stricto sensu)-Cerrado (lato sensu)-Floresta Ombrófila (= Floresta Pluvial)","Terrícola"
"574","Solanaceae","Solanum variabile Mart.","Solanum variabile Mart.",14880,"Solanaceae","Solanum variabile Mart.",14880,NA,"LFB","name ok","","Solanum variabile","NATIVA","Não endemica/Mata Atlântica","BR-SP-BR-RJ-BR-MG-BR-SC-BR-RS-BR-PR","Arbusto-Árvore","Campo de Altitude-Floresta Ombrófila (= Floresta Pluvial)-Floresta Ombrófila Mista","Terrícola"
"575","Moraceae","Sorocea hilarii Gaudich.","Sorocea hilarii Gaudich.",10193,"Moraceae","Sorocea hilarii Gaudich.",10193,NA,"LFB","name ok","","Sorocea hilarii","NATIVA","Endemica/Cerrado-Endemica/Mata Atlântica","BR-SP-BR-RJ-BR-MG-BR-ES-BR-PR-BR-BA","Arbusto-Árvore","Floresta Ombrófila (= Floresta Pluvial)-Restinga","Terrícola"
"576","Moraceae","Sorocea racemosa Gaudich.","Sorocea racemosa Gaudich.",10195,"Moraceae","Sorocea racemosa Gaudich.",10195,NA,"LFB","name ok","","Sorocea racemosa","NATIVA","Endemica/Mata Atlântica","BR-SP-BR-RJ-BR-ES","Arbusto-Árvore","Floresta Ombrófila (= Floresta Pluvial)","Terrícola"
"577","Hernandiaceae","Sparattanthelium botocudorum Mart.","Sparattanthelium botocudorum Mart.",17770,"Hernandiaceae","Sparattanthelium botocudorum Mart.",17770,NA,"LFB","name ok","","Sparattanthelium botocudorum","NATIVA","Endemica/Amazônia-Endemica/Caatinga-Endemica/Cerrado-Endemica/Mata Atlântica","BR-RJ-BR-ES-BR-PE-BR-CE-BR-BA-BR-PA-BR-AC-BR-MT","Arbusto","Floresta Estacional Semidecidual-Floresta Ombrófila (= Floresta Pluvial)","Terrícola"
"578","Anacardiaceae","Spondias tuberosa Arruda","Spondias tuberosa Arruda",4405,"Anacardiaceae","Spondias tuberosa Arruda",4405,"imbuzeiro-PORTUGUES-Nordeste/tapereba-PORTUGUES-Nordeste/umbu-PORTUGUES-Nordeste/caja-do-sertão-PORTUGUES-Bahia/umbuzeiro-PORTUGUES-Maranhão/imbu-verdadeiro-PORTUGUES-Minas Gerais/imburana-de-cambão-PORTUGUES-Pernambuco/imbuzeiro-PORTUGUES-Pernambuco","LFB","name ok","","Spondias tuberosa","NATIVA","Endemica/Caatinga-Endemica/Cerrado","BR-SP-BR-RJ-BR-ES-BR-MG-BR-SE-BR-RN-BR-PI-BR-PE-BR-PB-BR-MA-BR-CE-BR-BA-BR-AL","Arbusto-Árvore","Caatinga (stricto sensu)-Carrasco","Terrícola"
"579","Anacardiaceae","Spondias venulosa Mart. ex Engl.","Spondias venulosa (Engl.) Engl.",4406,"Anacardiaceae","Spondias venulosa (Engl.) Engl.",4406,"cajá-PORTUGUES-Nordeste/cajazeira-PORTUGUES-Sudeste","LFB","name ok","","Spondias venulosa","NATIVA","Endemica/Mata Atlântica","BR-SP-BR-RJ-BR-MG-BR-ES-BR-BA","Árvore","Floresta Ombrófila (= Floresta Pluvial)","Terrícola"
"580","Asteraceae","Stifftia chrysantha Mikan","Stifftia chrysantha J.C.Mikan",5507,"Asteraceae","Stifftia chrysantha J.C.Mikan",5507,NA,"LFB","","","Stifftia chrysantha","NATIVA","Não endemica/Mata Atlântica","BR-SP-BR-RJ-BR-MG-BR-PR-BR-BA","Árvore","Floresta Ombrófila (= Floresta Pluvial)","Terrícola"
"581","Euphorbiaceae","Stillingia trapezoidea Ule","Stillingia trapezoidea Ule",25573,"Euphorbiaceae","Stillingia trapezoidea Ule",25573,NA,"LFB","name ok","","Stillingia trapezoidea","NATIVA","Endemica/Caatinga","BR-BA-BR-SE-BR-PE-BR-PB-BR-PI","Arbusto-Subarbusto","Caatinga (stricto sensu)-Vegetação Sobre Afloramentos Rochosos","Rupícola-Terrícola"
"582","Euphorbiaceae","Stillingia uleana Pax & Hoffm.","Stillingia uleana Pax ex K.Hoffm.",17688,"Euphorbiaceae","Stillingia uleana Pax ex K.Hoffm.",17688,NA,"LFB","name ok","","Stillingia uleana","NATIVA","Endemica/Caatinga-Endemica/Cerrado","BR-MG-BR-BA","Arbusto-Árvore","Caatinga (stricto sensu)-Campo rupestre-Cerrado (lato sensu)-Vegetação Sobre Afloramentos Rochosos","Terrícola"
"583","Fabaceae","Stryphnodendron polyphyllum Mart.","Stryphnodendron polyphyllum Mart.",83739,"Fabaceae","Stryphnodendron polyphyllum Mart.",83739,NA,"LFB","name ok","","Stryphnodendron polyphyllum","NATIVA","Endemica/Caatinga-Endemica/Cerrado-Endemica/Mata Atlântica","BR-ES-BR-SP-BR-RJ-BR-MG-BR-BA","Árvore","Caatinga (stricto sensu)-Cerrado (lato sensu)-Floresta Estacional Semidecidual","Terrícola"
"584","Fabaceae","Stryphnodendron rotundifolium Mart.","Stryphnodendron rotundifolium Mart.",83743,"Fabaceae","Stryphnodendron rotundifolium Mart.",83743,"Barbatimão-da-folha-miúda-PORTUGUES-Sudeste","LFB","name ok","","Stryphnodendron rotundifolium","NATIVA","Não endemica/Caatinga-Não endemica/Cerrado-Não endemica/Pantanal","BR-SP-BR-MG-BR-PR-BR-PI-BR-MA-BR-CE-BR-BA-BR-TO-BR-PA-BR-AM-BR-MT-BR-MS-BR-GO","Arbusto-Árvore","Campo Limpo-Campo rupestre-Cerrado (lato sensu)","Terrícola"
"585","Styracaceae","Styrax camporum Pohl","Styrax camporum Pohl",21251,"Styracaceae","Styrax camporum Pohl",21251,NA,"LFB","name ok","","Styrax camporum","NATIVA","Não endemica/Caatinga-Não endemica/Cerrado-Não endemica/Mata Atlântica","BR-TO-BR-MS-BR-GO-BR-DF-BR-SP-BR-MG-BR-ES-BR-PR-BR-PE-BR-CE-BR-BA","Arbusto-Árvore","Campo rupestre-Carrasco-Cerrado (lato sensu)-Floresta Ciliar ou Galeria-Floresta Estacional Decidual-Floresta Estacional Semidecidual-Floresta Ombrófila (= Floresta Pluvial)","Terrícola"
"586","Styracaceae","Styrax martii Seub.","Styrax martii Seub.",26128,"Styracaceae","Styrax martii Seub.",26128,NA,"LFB","name ok","","Styrax martii","NATIVA","Endemica/Cerrado-Endemica/Mata Atlântica","BR-SP-BR-RJ-BR-MG-BR-RS-BR-PR","Arbusto-Árvore","Campo de Altitude-Campo rupestre-Floresta Ciliar ou Galeria","Terrícola"
"587","Fabaceae","Swartzia apetala Raddi","Swartzia apetala Raddi",23180,"Fabaceae","Swartzia apetala Raddi",23180,NA,"LFB","name ok","","Swartzia apetala",NA,NA,NA,NA,NA,NA
"588","Fabaceae","Swartzia laurifolia Benth.","Swartzia laurifolia Benth.",83782,"Fabaceae","Swartzia laurifolia Benth.",83782,NA,"LFB","name ok","","Swartzia laurifolia","NATIVA","Endemica/Amazônia","BR-MA-BR-RR-BR-RO-BR-PA-BR-AP-BR-AM-BR-MT","Árvore","Floresta de Igapó-Floresta de Terra Firme-Floresta de Várzea","Terrícola"
"589","Fabaceae","Swartzia recurva Poepp.","Swartzia recurva Poepp.",78812,"Fabaceae","Swartzia recurva Poepp.",78812,"Muira Jibóia-PORTUGUES-Norte-Brasil","LFB","name ok","","Swartzia recurva","NATIVA","Endemica/Amazônia","BR-RR-BR-RO-BR-PA-BR-AM-BR-MT","Árvore","Campinarana-Floresta de Igapó-Floresta de Terra Firme","Terrícola"
"590","Arecaceae","Syagrus coronata Becc.","Syagrus coronata (Mart.) Becc.",15736,"Arecaceae","Syagrus coronata (Mart.) Becc.",15736,NA,"LFB","name ok","","Syagrus coronata","NATIVA","Endemica/Caatinga-Endemica/Cerrado","BR-MG-BR-SE-BR-PE-BR-BA-BR-AL","Palmeira","Área Antrópica-Caatinga (stricto sensu)-Cerrado (lato sensu)-Vegetação Sobre Afloramentos Rochosos","Terrícola"
"591","Arecaceae","Syagrus vagans (Bondar) A.D.Hawkes","Syagrus vagans (Bondar) A.D.Hawkes",15747,"Arecaceae","Syagrus vagans (Bondar) A.D.Hawkes",15747,"ariri-PORTUGUES-BA/licurioba-PORTUGUES-BA","LFB","name ok","","Syagrus vagans","NATIVA","Endemica/Caatinga","BR-BA","Palmeira","Caatinga (stricto sensu)","Terrícola"
"592","Symplocaceae","Symplocos estrellensis Casar.","Symplocos estrellensis Casar.",111277,"Symplocaceae","Symplocos estrellensis Casar.",111277,"canela-conserva-PORTUGUES-São Paulo/catatu-PORTUGUES-Paraná/congonha-PORTUGUES-Rio de Janeiro/congonha-de-folha-grande-PORTUGUES-Rio de Janeiro/mandioqueira-PORTUGUES-Paraná/orelha-de-onça-PORTUGUES-Rio de Janeiro","LFB","name ok","","Symplocos estrellensis","NATIVA","Endemica/Mata Atlântica","BR-SP-BR-RJ-BR-MG-BR-ES-BR-SC-BR-PR-BR-BA","Arbusto-Árvore","Área Antrópica-Floresta Estacional Semidecidual-Floresta Ombrófila (= Floresta Pluvial)-Floresta Ombrófila Mista","Terrícola"
"593","Symplocaceae","Symplocos glandulosomarginata Hoehne","Symplocos glandulosomarginata Hoehne",14903,"Symplocaceae","Symplocos glandulosomarginata Hoehne",14903,"bracunhá-PORTUGUES-Paraná/falsa-caneta-PORTUGUES-Paraná/maria-mole-PORTUGUES-Paraná","LFB","name ok","","Symplocos glandulosomarginata","NATIVA","Endemica/Mata Atlântica","BR-SP-BR-SC-BR-PR","Arbusto-Árvore","Área Antrópica-Campo de Altitude-Floresta Ciliar ou Galeria-Floresta Estacional Semidecidual-Floresta Ombrófila (= Floresta Pluvial)-Floresta Ombrófila Mista","Terrícola"
"594","Symplocaceae","Symplocos laxiflora Benth.","Symplocos laxiflora Benth.",14908,"Symplocaceae","Symplocos laxiflora Benth.",14908,"bofe-PORTUGUES-Paraná/vanvu-PORTUGUES-Paraná","LFB","name ok","","Symplocos laxiflora","NATIVA","Endemica/Mata Atlântica","BR-SP-BR-RJ-BR-PR","Árvore","Área Antrópica-Floresta Ciliar ou Galeria-Floresta Estacional Semidecidual-Floresta Ombrófila (= Floresta Pluvial)-Restinga","Terrícola"
