"","original_family","original_name","name_in_Flora","original_ID","final_family","scientificName","taxonID","vernacular_names","notes","tax_notes","notes_fam","nombre","establishmentMeans","occurrenceRemarks","location","lifeForm","vegetationType","habitat"
"332","Melastomataceae","Leandra barbinervis Cogn.","Leandra barbinervis (Cham. ex Triana) Cogn.",9509,"Melastomataceae","Leandra barbinervis (Cham. ex Triana) Cogn.",9509,NA,"LFB","name ok","","Leandra barbinervis","NATIVA","Endemica/Mata Atlântica","BR-SP-BR-RJ-BR-MG-BR-SC-BR-PR","Arbusto-Árvore","Campo de Altitude-Floresta Ombrófila (= Floresta Pluvial)","Terrícola"
"333","Melastomataceae","Leandra clidemioides (Naudin) Wurdack","Leandra clidemioides (Naudin) Wurdack",9519,"Melastomataceae","Leandra clidemioides (Naudin) Wurdack",9519,NA,"LFB","name ok","","Leandra clidemioides","NATIVA","Endemica/Mata Atlântica","BR-SP-BR-RJ-BR-ES-BR-BA","Arbusto-Árvore","Floresta Ombrófila (= Floresta Pluvial)","Terrícola"
"334","Melastomataceae","Leandra fragilis Cogn.","Leandra fragilis Cogn.",9542,"Melastomataceae","Leandra melastomoides Raddi",9572,"cambará-do-mato-PORTUGUES-Sudeste/pixirica-PORTUGUES-Sudeste","LFB","synonym","","Leandra melastomoides","NATIVA","Não endemica/Cerrado-Não endemica/Mata Atlântica","BR-SP-BR-RJ-BR-MG-BR-ES-BR-SC-BR-PR-BR-PB-BR-BA-BR-GO-BR-DF","Arbusto-Árvore","Área Antrópica-Cerrado (lato sensu)-Floresta Ciliar ou Galeria-Floresta Ombrófila (= Floresta Pluvial)-Restinga","Terrícola"
"335","Melastomataceae","Leandra purpureovillosa Hoehne","Leandra purpureovillosa Hoehne",9599,"Melastomataceae","Leandra purpureovillosa Hoehne",9599,NA,"LFB","name ok","","Leandra purpureovillosa","NATIVA","Endemica/Mata Atlântica","BR-SP-BR-RJ-BR-MG-BR-SC-BR-RS-BR-PR","Arbusto-Árvore","Campo de Altitude-Floresta Ciliar ou Galeria-Floresta Ombrófila (= Floresta Pluvial)-Floresta Ombrófila Mista","Terrícola"
"336","Melastomataceae","Leandra quinquedentata Cogn.","Leandra quinquedentata (DC.) Cogn.",9600,"Melastomataceae","Leandra quinquedentata (DC.) Cogn.",9600,NA,"LFB","name ok","","Leandra quinquedentata","NATIVA","Endemica/Cerrado-Endemica/Mata Atlântica","BR-SP-BR-RJ-BR-MG-BR-SC-BR-RS-BR-PR-BR-BA","Arbusto-Árvore","Campo de Altitude-Campo rupestre-Cerrado (lato sensu)-Floresta Ombrófila (= Floresta Pluvial)-Floresta Ombrófila Mista","Terrícola"
"337","Melastomataceae","Leandra variabilis Raddi","Leandra variabilis Raddi",9638,"Melastomataceae","Leandra variabilis Raddi",9638,NA,"LFB","name ok","","Leandra variabilis","NATIVA","Endemica/Mata Atlântica","BR-PR-BR-SC-BR-RS-BR-ES-BR-MG-BR-BA-BR-SP-BR-RJ","Arbusto-Árvore","Floresta Ombrófila (= Floresta Pluvial)","Terrícola"
"338","Icacinaceae","Leretia cordata Vell.","Leretia cordata Vell.",8034,"Icacinaceae","Leretia cordata Vell.",8034,"surucuína-PORTUGUES-Acre/puca yacua-PORTUGUES-NA","LFB","name ok","","Leretia cordata","NATIVA","Endemica/Amazônia-Endemica/Cerrado-Endemica/Mata Atlântica","BR-RJ-BR-MG-BR-ES-BR-MA-BR-BA-BR-RR-BR-RO-BR-PA-BR-AP-BR-AM-BR-AC-BR-MT-BR-DF","Arbusto-Árvore-Liana/volúvel/trepadeira","Floresta Ciliar ou Galeria-Floresta de Terra Firme-Floresta Ombrófila (= Floresta Pluvial)","Terrícola"
"339","Fabaceae","Leucochloron incuriale (Vell.) Barneby & J.W.Grimes","Leucochloron incuriale (Vell.) Barneby & J.W.Grimes",31038,"Fabaceae","Leucochloron incuriale (Vell.) Barneby & J.W.Grimes",31038,NA,"LFB","name ok","","Leucochloron incuriale","NATIVA","Endemica/Cerrado-Endemica/Mata Atlântica","BR-ES-BR-SP-BR-RJ-BR-MG-BR-PR","Arbusto-Árvore","Cerrado (lato sensu)-Floresta Estacional Semidecidual","Terrícola"
"340","Fabaceae","Libidibia ferrea (Mart. ex Tul.) L.P.Queiroz","Libidibia ferrea (Mart. ex Tul.) L.P.Queiroz",109828,"Fabaceae","Libidibia ferrea (Mart. ex Tul.) L.P.Queiroz",109828,NA,"LFB","name ok","","Libidibia ferrea","NATIVA","Endemica/Caatinga-Endemica/Cerrado-Endemica/Mata Atlântica","BR-RJ-BR-MG-BR-ES-BR-SE-BR-RN-BR-PI-BR-PE-BR-PB-BR-MA-BR-CE-BR-BA-BR-AL",NA,NA,NA
"341","Chrysobalanaceae","Licania dealbata Hook.f.","Licania dealbata Hook.f.",16823,"Chrysobalanaceae","Licania dealbata Hook.f.",16823,NA,"LFB","name ok","","Licania dealbata","NATIVA","Endemica/Amazônia-Endemica/Caatinga-Endemica/Cerrado","BR-MG-BR-PI-BR-MA-BR-BA-BR-TO-BR-GO-BR-DF","Arbusto-Árvore","Cerrado (lato sensu)","Terrícola"
"342","Chrysobalanaceae","Licania kunthiana Hook.f.","Licania kunthiana Hook.f.",16832,"Chrysobalanaceae","Licania kunthiana Hook.f.",16832,NA,"LFB","name ok","","Licania kunthiana","NATIVA","Endemica/Amazônia-Endemica/Caatinga-Endemica/Cerrado-Endemica/Mata Atlântica","BR-SP-BR-RJ-BR-MG-BR-ES-BR-SE-BR-PE-BR-MA-BR-BA-BR-TO-BR-RR-BR-RO-BR-PA-BR-AP-BR-AM-BR-AC-BR-MT-BR-MS-BR-GO-BR-DF","Árvore","Cerrado (lato sensu)-Floresta de Terra Firme-Floresta Ombrófila (= Floresta Pluvial)","Terrícola"
"343","Chrysobalanaceae","Licania littoralis Warm.","Licania littoralis Warm.",16837,"Chrysobalanaceae","Licania littoralis Warm.",16837,NA,"LFB","name ok","","Licania littoralis",NA,NA,NA,"Arbusto-Árvore","Floresta Ombrófila (= Floresta Pluvial)-Restinga","Terrícola"
"344","Chrysobalanaceae","Licania tomentosa Fritsch","Licania tomentosa (Benth.) Fritsch",16857,"Chrysobalanaceae","Licania tomentosa (Benth.) Fritsch",16857,NA,"LFB","name ok","","Licania tomentosa","NATIVA","Endemica/Mata Atlântica","BR-PI-BR-PE-BR-PB-BR-CE-BR-BA","Árvore","Floresta Ombrófila (= Floresta Pluvial)-Restinga","Terrícola"
"345","Lauraceae","Licaria bahiana H.Kurz","Licaria bahiana Kurz",8420,"Lauraceae","Licaria bahiana Kurz",8420,"louro-sabão-PORTUGUES-Bahia","LFB","name ok","","Licaria bahiana","NATIVA","Endemica/Mata Atlântica","BR-ES-BR-BA-BR-AL","Árvore","Floresta Ombrófila (= Floresta Pluvial)","Terrícola"
"346","Achariaceae","Lindackeria latifolia Benth.","Lindackeria latifolia Benth.",78300,"Achariaceae","Lindackeria latifolia Benth.",78300,NA,"LFB","name ok","","Lindackeria latifolia","NATIVA","Endemica/Amazônia-Endemica/Cerrado","BR-MA-BR-RO-BR-PA-BR-AM","Arbusto-Árvore","Floresta de Terra Firme","Terrícola"
"347","Malvaceae","Luehea ochrophylla Mart.","Luehea ochrophylla Mart.",9096,"Malvaceae","Luehea ochrophylla Mart.",9096,NA,"LFB","name ok","","Luehea ochrophylla","NATIVA","Não endemica/Amazônia-Não endemica/Caatinga-Não endemica/Cerrado-Não endemica/Mata Atlântica","BR-CE-BR-RJ-BR-ES-BR-SE-BR-PE-BR-PB-BR-BA-BR-AL-BR-AM","Árvore","Floresta Estacional Semidecidual-Floresta Ombrófila (= Floresta Pluvial)","Terrícola"
"348","Fabaceae","Luetzelburgia auriculata (Allemão) Ducke","Luetzelburgia auriculata (Allemão) Ducke",29740,"Fabaceae","Luetzelburgia auriculata (Allemão) Ducke",29740,"Angelim-da-folha-miúda-PORTUGUES-Piauí/Pau-de-chapada-PORTUGUES-Maranhão/Pau-mocó-PORTUGUES-Ceará/Pau-pedra-PORTUGUES-Rio Grande do Norte","LFB","name ok","","Luetzelburgia auriculata","NATIVA","Endemica/Amazônia-Endemica/Caatinga-Endemica/Cerrado","BR-MG-BR-GO-BR-MS-BR-MT-BR-DF-BR-TO-BR-PA-BR-RN-BR-PI-BR-PE-BR-PB-BR-MA-BR-CE-BR-BA","Árvore","Caatinga (stricto sensu)-Carrasco-Cerrado (lato sensu)","Terrícola"
"349","Fabaceae","Luetzelburgia bahiensis Yakovlev","Luetzelburgia bahiensis Yakovlev",18701,"Fabaceae","Luetzelburgia bahiensis Yakovlev",18701,"Carne-d'anta-PORTUGUES-Bahia/Moela-de-galinha-PORTUGUES-Bahia/Pau-de-ema-PORTUGUES-Bahia/Pau-mocó-PORTUGUES-Bahia","LFB","name ok","","Luetzelburgia bahiensis","NATIVA","Endemica/Caatinga","BR-PI-BR-PE-BR-BA","Arbusto-Árvore","Caatinga (stricto sensu)","Terrícola"
"350","Asteraceae","Lychnophora salicifolia Mart.","Lychnophora salicifolia Mart.",16181,"Asteraceae","Lychnophora salicifolia Mart.",16181,NA,"LFB","name ok","","Lychnophora salicifolia","NATIVA","Endemica/Cerrado","BR-MG-BR-BA-BR-GO-BR-DF","Árvore","Campo rupestre-Cerrado (lato sensu)","Terrícola"
"351","Fabaceae","Machaerium cantarellianum Hoehne","Machaerium cantarellianum Hoehne",101136,"Fabaceae","Machaerium cantarellianum Hoehne",101136,"Jacarandá-bico-de-pato-PORTUGUES-NA/Jacarandá-trepador-PORTUGUES-NA","LFB","name ok","","Machaerium cantarellianum","NATIVA","Endemica/Mata Atlântica","BR-SP-BR-RJ-BR-MG-BR-ES","Arbusto-Árvore-Liana/volúvel/trepadeira","Floresta Estacional Semidecidual-Floresta Ombrófila (= Floresta Pluvial)","Terrícola"
"352","Fabaceae","Machaerium punctatum Pers.","Machaerium punctatum (Poir.) Pers.",83326,"Fabaceae","Machaerium punctatum (Poir.) Pers.",83326,NA,"LFB","name ok","","Machaerium punctatum","NATIVA","Endemica/Caatinga-Endemica/Cerrado-Endemica/Mata Atlântica","BR-MG-BR-RJ-BR-BA","Arbusto-Árvore","Caatinga (stricto sensu)-Campo rupestre-Cerrado (lato sensu)-Floresta Estacional Semidecidual","Terrícola"
"353","Fabaceae","Machaerium salzmannii Benth.","Machaerium salzmannii Benth.",18735,"Fabaceae","Machaerium salzmannii Benth.",18735,"Cipó-siqueira-PORTUGUES-NA/Mata-pau-PORTUGUES-NA","LFB","name ok","","Machaerium salzmannii","NATIVA","Endemica/Mata Atlântica","BR-ES-BR-PE-BR-PB-BR-BA-BR-AL","Arbusto-Árvore-Liana/volúvel/trepadeira","Floresta Estacional Semidecidual-Floresta Ombrófila (= Floresta Pluvial)","Terrícola"
"354","Fabaceae","Macrolobium campestre Huber","Macrolobium campestre Huber",23069,"Fabaceae","Macrolobium campestre Huber",23069,NA,"LFB","name ok","","Macrolobium campestre","NATIVA","Endemica/Amazônia","BR-MT-BR-MA-BR-RO-BR-PA-BR-AP-BR-AM-BR-AC","Arbusto-Árvore","Campinarana-Floresta de Igapó-Floresta Ombrófila (= Floresta Pluvial)","Terrícola"
"355","Monimiaceae","Macropeplus ligustrinus Perkins","Macropeplus ligustrinus (Tul.) Perkins",10066,"Monimiaceae","Macropeplus ligustrinus (Tul.) Perkins",10066,NA,"LFB","name ok","","Macropeplus ligustrinus","NATIVA","Endemica/Cerrado-Endemica/Mata Atlântica","BR-MG-BR-BA-BR-GO-BR-DF","Arbusto-Árvore","Campo rupestre-Floresta Ciliar ou Galeria-Floresta Estacional Semidecidual","Terrícola"
"356","Fabaceae","Macrosamanea duckei (Huber) Barneby & J.W.Grimes","Macrosamanea duckei (Huber) Barneby & J.W.Grimes",83379,"Fabaceae","Macrosamanea duckei (Huber) Barneby & J.W.Grimes",83379,NA,"LFB","name ok","","Macrosamanea duckei","NATIVA","Endemica/Amazônia","BR-RO-BR-PA-BR-AM","Arbusto-Árvore-Liana/volúvel/trepadeira","Floresta de Igapó-Floresta de Várzea","Terrícola"
"357","Salicaceae","Macrothumia kuhlmannii (Sleumer) M.H.Alford","Macrothumia kuhlmannii (Sleumer) M.H.Alford",14388,"Salicaceae","Macrothumia kuhlmannii (Sleumer) M.H.Alford",14388,NA,"LFB","name ok","","Macrothumia kuhlmannii","NATIVA","Endemica/Mata Atlântica","BR-MG-BR-ES-BR-BA","Árvore","Cerrado (lato sensu)-Floresta Ombrófila (= Floresta Pluvial)","Terrícola"
"358","Euphorbiaceae","Manihot epruinosa Pax & K.Hoffm.","Manihot epruinosa Pax & K.Hoffm.",17599,"Euphorbiaceae","Manihot carthagenensis (Jacq.) Müll.Arg.",29288,NA,"LFB","synonym","","Manihot carthagenensis","NATIVA","Não endemica/Amazônia-Não endemica/Caatinga-Não endemica/Cerrado","BR-SE-BR-RN-BR-PI-BR-MA-BR-AL-BR-PA-BR-AM-BR-MG-BR-PE-BR-PB-BR-CE-BR-BA","Arbusto-Árvore","Caatinga (stricto sensu)-Floresta Estacional Semidecidual-Floresta Ombrófila (= Floresta Pluvial)","Terrícola"
"359","Euphorbiaceae","Manihot pilosa Pohl","Manihot pilosa Pohl",29312,"Euphorbiaceae","Manihot pilosa Pohl",29312,NA,"LFB","name ok","","Manihot pilosa","NATIVA","Endemica/Mata Atlântica","BR-ES-BR-SP-BR-RJ-BR-MG","Arbusto-Árvore-Liana/volúvel/trepadeira","Floresta Estacional Semidecidual-Floresta Ombrófila (= Floresta Pluvial)","Terrícola"
"360","Sapotaceae","Manilkara salzmannii (A.DC.) H.J.Lam","Manilkara salzmannii (A.DC.) H.J.Lam",14482,"Sapotaceae","Manilkara salzmannii (A.DC.) H.J.Lam",14482,"Maçaranduba-PORTUGUES-NA","LFB","name ok","","Manilkara salzmannii","NATIVA","Endemica/Caatinga-Endemica/Mata Atlântica","BR-RJ-BR-ES-BR-PR-BR-SE-BR-RN-BR-PI-BR-PE-BR-PB-BR-CE-BR-BA-BR-AL","Árvore","Floresta Estacional Semidecidual-Restinga","Terrícola"
"361","Sapotaceae","Manilkara triflora (Allem.) Monach.","Manilkara triflora (Allemão) Monach.",14484,"Sapotaceae","Manilkara triflora (Allemão) Monach.",14484,"maçarandubarana-PORTUGUES-Pará","LFB","name ok","","Manilkara triflora","NATIVA","Endemica/Amazônia-Endemica/Caatinga-Endemica/Cerrado-Endemica/Mata Atlântica","BR-ES-BR-GO-BR-SE-BR-MA-BR-MG-BR-RN-BR-PI-BR-CE-BR-BA-BR-PA","Arbusto-Árvore","Caatinga (stricto sensu)-Floresta de Terra Firme-Restinga","Terrícola"
"362","Rubiaceae","Margaritopsis cymuligera (Müll.Arg.) C.M.Taylor","Margaritopsis cymuligera (Müll.Arg.) C.M.Taylor",14113,"Rubiaceae","Margaritopsis cymuligera (Müll.Arg.) C.M.Taylor",14113,NA,"LFB","name ok","","Margaritopsis cymuligera","NATIVA","Endemica/Mata Atlântica","BR-SC-BR-RS-BR-ES-BR-SP-BR-RJ-BR-MG-BR-PR-BR-BA","Arbusto","Floresta Ciliar ou Galeria-Floresta Ombrófila (= Floresta Pluvial)","Terrícola"
"363","Myrtaceae","Marlierea clausseniana Kiaersk.","Marlierea clausseniana (O.Berg) Kiaersk.",10584,"Myrtaceae","Marlierea clausseniana (O.Berg) Kiaersk.",10584,NA,"LFB","name ok","","Marlierea clausseniana","NATIVA","Endemica/Caatinga-Endemica/Cerrado-Endemica/Mata Atlântica","BR-SP-BR-RJ-BR-MG-BR-ES-BR-BA","Árvore","Campo rupestre-Cerrado (lato sensu)-Floresta Estacional Semidecidual","Terrícola"
"364","Sapindaceae","Matayba discolor Radlk.","Matayba discolor (Spreng.) Radlk.",20908,"Sapindaceae","Matayba discolor (Spreng.) Radlk.",20908,"camboatá-branco-PORTUGUES-Nordeste/camboatá de cotia-PORTUGUES-Nordeste/pitomba-rosa-PORTUGUES-Nordeste/zeca-tatú-PORTUGUES-Norte","LFB","name ok","","Matayba discolor","NATIVA","Endemica/Mata Atlântica","BR-PE-BR-PB-BR-PA-BR-AP-BR-AM-BR-ES-BR-SE-BR-BA-BR-AL","Arbusto-Árvore","Floresta Ciliar ou Galeria-Floresta Ombrófila (= Floresta Pluvial)-Restinga","Terrícola"
"365","Sapindaceae","Matayba heterophylla Radlk.","Matayba heterophylla (Mart.) Radlk.",20910,"Sapindaceae","Matayba heterophylla (Mart.) Radlk.",20910,"pitombeira-PORTUGUES-Nordeste","LFB","name ok","","Matayba heterophylla","NATIVA","Endemica/Caatinga-Endemica/Cerrado","BR-MG-BR-PI-BR-PE-BR-MA-BR-BA-BR-TO-BR-GO","Arbusto-Árvore-Subarbusto","Caatinga (stricto sensu)-Campo de Altitude-Campo rupestre-Cerrado (lato sensu)","Terrícola"
"366","Sapindaceae","Matayba intermedia Radlk.","Matayba intermedia Radlk.",103420,"Sapindaceae","Matayba intermedia Radlk.",103420,"camboatá-PORTUGUES-Sudeste e Sul/camboata-de-folha-miúda-PORTUGUES-Sudeste e Sul/mataíba-PORTUGUES-Sudeste","LFB","name ok","","Matayba intermedia","NATIVA","Endemica/Mata Atlântica","BR-ES-BR-BA-BR-SP-BR-RJ-BR-SC-BR-RS-BR-PR","Arbusto-Árvore","Floresta Ciliar ou Galeria-Floresta Ombrófila (= Floresta Pluvial)-Restinga","Terrícola"
"367","Sapindaceae","Matayba juglandifolia Radlk.","Matayba juglandifolia (Cambess.) Radlk.",20911,"Sapindaceae","Matayba juglandifolia (Cambess.) Radlk.",20911,"camboatá-PORTUGUES-Sul/camboatá-amarelo-PORTUGUES-Sudeste/camboatã-PORTUGUES-Sul e Sudeste/caxuá-branco-PORTUGUES-Nordeste/pau-de-pombo-PORTUGUES-Sudeste/tata-piririca-PORTUGUES-Nordeste","LFB","name ok","","Matayba juglandifolia","NATIVA","Endemica/Cerrado-Endemica/Mata Atlântica","BR-SP-BR-RJ-BR-MG","Árvore","Cerrado (lato sensu)-Floresta Ciliar ou Galeria-Floresta Estacional Semidecidual-Floresta Ombrófila (= Floresta Pluvial)","Terrícola"
"368","Sapindaceae","Matayba marginata Radlk.","Matayba marginata Radlk.",32721,"Sapindaceae","Matayba marginata Radlk.",32721,NA,"LFB","name ok","","Matayba marginata","NATIVA","Endemica/Caatinga-Endemica/Cerrado-Endemica/Mata Atlântica","BR-SP-BR-RJ-BR-MG-BR-PR","Arbusto-Árvore-Subarbusto","Campo rupestre-Cerrado (lato sensu)-Floresta Ciliar ou Galeria-Floresta Ombrófila (= Floresta Pluvial)-Vegetação Sobre Afloramentos Rochosos","Terrícola"
"369","Celastraceae","Maytenus catingarum Reiss.","Maytenus catingarum Reissek",16747,"Celastraceae","Monteverdia catingarum (Reissek) Biral",604506,NA,"LFB","synonym","","Monteverdia catingarum","NATIVA","Endemica/Caatinga-Endemica/Cerrado","BR-BA","Arbusto","Campo rupestre","Terrícola"
"370","Celastraceae","Maytenus distichophylla Mart. ex Reiss.","Maytenus distichophylla Mart. ex Reissek",6756,"Celastraceae","Monteverdia distichophylla (Mart. ex Reissek) Biral",604540,NA,"LFB","synonym","","Monteverdia distichophylla",NA,NA,NA,NA,NA,NA
"371","Celastraceae","Maytenus gonoclada Mart.","Maytenus gonoclada Mart.",6761,"Celastraceae","Maytenus gonoclada Mart.",6761,NA,"LFB","name ok","","Maytenus gonoclada","NATIVA","Não endemica/Amazônia-Não endemica/Cerrado-Não endemica/Mata Atlântica","BR-GO-BR-DF-BR-RO-BR-SP-BR-RJ-BR-MG-BR-ES-BR-SC-BR-PR-BR-BA","Arbusto-Árvore","Cerrado (lato sensu)-Floresta Ciliar ou Galeria-Floresta Estacional Decidual-Floresta Estacional Semidecidual-Floresta Ombrófila (= Floresta Pluvial)-Floresta Ombrófila Mista-Manguezal-Restinga-Vegetação Sobre Afloramentos Rochosos","Terrícola"
"372","Celastraceae","Maytenus obtusifolia Mart.","Maytenus obtusifolia Mart.",6766,"Celastraceae","Maytenus obtusifolia Mart.",6766,NA,"LFB","name ok","","Maytenus obtusifolia","NATIVA","Endemica/Amazônia-Endemica/Cerrado-Endemica/Mata Atlântica","BR-RN-BR-AL-BR-MA-BR-SP-BR-RJ-BR-ES-BR-SE-BR-PE-BR-PB-BR-CE-BR-BA-BR-PA","Arbusto-Árvore","Floresta Estacional Semidecidual-Floresta Ombrófila (= Floresta Pluvial)-Restinga","Terrícola"
"373","Celastraceae","Maytenus rigida Mart.","Maytenus rigida Mart.",16752,"Celastraceae","Monteverdia rigida (Mart.) Biral",604679,"Bom-nome-PORTUGUES-Nordeste","LFB","synonym","","Monteverdia rigida",NA,NA,NA,NA,NA,NA
"374","Celastraceae","Maytenus salicifolia Reiss.","Maytenus salicifolia Reissek",6769,"Celastraceae","Maytenus gonoclada Mart.",6761,NA,"LFB","synonym","","Maytenus gonoclada","NATIVA","Não endemica/Amazônia-Não endemica/Cerrado-Não endemica/Mata Atlântica","BR-GO-BR-DF-BR-RO-BR-SP-BR-RJ-BR-MG-BR-ES-BR-SC-BR-PR-BR-BA","Arbusto-Árvore","Cerrado (lato sensu)-Floresta Ciliar ou Galeria-Floresta Estacional Decidual-Floresta Estacional Semidecidual-Floresta Ombrófila (= Floresta Pluvial)-Floresta Ombrófila Mista-Manguezal-Restinga-Vegetação Sobre Afloramentos Rochosos","Terrícola"
"375","Celastraceae","Maytenus schumanniana Loes.","Maytenus schumanniana Loes.",6771,"Celastraceae","Monteverdia schummaniana (Loes.) Biral",604626,NA,"LFB","synonym","","Monteverdia schummaniana","NATIVA","Endemica/Mata Atlântica","BR-PR-BR-SC-BR-ES-BR-MG-BR-SP-BR-RJ-BR-BA","Arbusto-Árvore","Floresta Estacional Decidual-Floresta Ombrófila (= Floresta Pluvial)-Restinga","Terrícola"
"376","Sabiaceae","Meliosma sellowii Urban","Meliosma sellowii Urb.",14346,"Sabiaceae","Meliosma sellowii Urb.",14346,"Canela-balão-PORTUGUES-Rio de Janeiro/canela-caju-PORTUGUES-Minas Gerais/pau-fernandes-PORTUGUES-Santa Catarina","LFB","name ok","","Meliosma sellowii","NATIVA","Endemica/Cerrado-Endemica/Mata Atlântica","BR-SP-BR-RJ-BR-MG-BR-ES-BR-SC-BR-RS-BR-PR-BR-BA-BR-GO","Árvore","Cerrado (lato sensu)-Floresta Estacional Semidecidual-Floresta Ombrófila (= Floresta Pluvial)-Floresta Ombrófila Mista","Terrícola"
"377","Rutaceae","Metrodorea nigra A. St.-Hil.","Metrodorea nigra A.St.-Hil.",819,"Rutaceae","Metrodorea nigra A.St.-Hil.",819,"carrapateiro-PORTUGUES-PR/chupa-ferro-PORTUGUES-SP/pitaguará-PORTUGUES-SP/vira-sarerê-PORTUGUES-BA","LFB","name ok","","Metrodorea nigra","NATIVA","Endemica/Amazônia-Endemica/Caatinga-Endemica/Cerrado-Endemica/Mata Atlântica","BR-SP-BR-RJ-BR-MG-BR-ES-BR-PR-BR-PI-BR-MA-BR-BA","Árvore","Floresta Ciliar ou Galeria-Floresta Estacional Semidecidual-Floresta Ombrófila (= Floresta Pluvial)","Terrícola"
"378","Rutaceae","Metrodorea stipularis Mart.","Metrodorea stipularis Mart.",823,"Rutaceae","Metrodorea stipularis Mart.",823,"arco-de-pipa-PORTUGUES-MG/caputuna-PORTUGUES-SP/cataguá-PORTUGUES-SP/laranjeira-do-mato-PORTUGUES-MG/limoeira-do-mato-PORTUGUES-MG","LFB","name ok","","Metrodorea stipularis","NATIVA","Endemica/Cerrado-Endemica/Mata Atlântica","BR-ES-BR-SP-BR-RJ-BR-MG-BR-MT-BR-GO-BR-DF","Árvore","Floresta Estacional Semidecidual","Terrícola"
"379","Solanaceae","Metternichia princeps Mikan","Metternichia princeps J.C.Mikan",21152,"Solanaceae","Metternichia princeps J.C.Mikan",21152,NA,"LFB","name ok","","Metternichia princeps",NA,NA,NA,NA,NA,NA
"380","Melastomataceae","Miconia buddlejoides Triana",NA,NA,"Melastomataceae","Miconia buddlejoides Triana",NA,NA,"not found",NA,"","Miconia buddlejoides",NA,NA,NA,NA,NA,NA
"381","Melastomataceae","Miconia burchellii Triana","Miconia burchellii Triana",30713,"Melastomataceae","Miconia burchellii Triana",30713,NA,"LFB","name ok","","Miconia burchellii","NATIVA","Endemica/Cerrado","BR-MG-BR-TO-BR-GO-BR-DF","Arbusto","Campo rupestre-Cerrado (lato sensu)","Terrícola"
"382","Melastomataceae","Miconia cabucu Hoehne","Miconia cabucu Hoehne",9678,"Melastomataceae","Miconia cabucu Hoehne",9678,NA,"LFB","name ok","","Miconia cabucu","NATIVA","Endemica/Mata Atlântica","BR-SP-BR-SC-BR-PR","Árvore","Floresta Ombrófila (= Floresta Pluvial)","Terrícola"
"383","Melastomataceae","Miconia caudigera DC.","Miconia caudigera DC.",9681,"Melastomataceae","Miconia caudigera DC.",9681,NA,"LFB","name ok","","Miconia caudigera","NATIVA","Endemica/Caatinga-Endemica/Cerrado","BR-MG-BR-BA","Arbusto-Árvore","Campo rupestre-Cerrado (lato sensu)-Floresta Ciliar ou Galeria","Terrícola"
"384","Melastomataceae","Miconia chartacea Triana","Miconia chartacea Triana",9684,"Melastomataceae","Miconia chartacea Triana",9684,NA,"LFB","name ok","","Miconia chartacea","NATIVA","Endemica/Cerrado-Endemica/Mata Atlântica","BR-SP-BR-RJ-BR-MG-BR-ES-BR-SC-BR-PR-BR-BA-BR-GO-BR-DF","Árvore","Cerrado (lato sensu)-Floresta Ciliar ou Galeria-Floresta Ombrófila (= Floresta Pluvial)","Terrícola"
"385","Melastomataceae","Miconia cinnamomifolia (DC.) Naud.","Miconia cinnamomifolia (DC.) Naudin",9688,"Melastomataceae","Miconia cinnamomifolia (DC.) Naudin",9688,NA,"LFB","name ok","","Miconia cinnamomifolia","NATIVA","Endemica/Mata Atlântica","BR-PE-BR-SP-BR-RJ-BR-MG-BR-ES-BR-SC-BR-PR-BR-BA","Arbusto-Árvore","Floresta Ombrófila (= Floresta Pluvial)","Terrícola"
"386","Melastomataceae","Miconia corallina Spring","Miconia corallina Spring",30717,"Melastomataceae","Miconia corallina Spring",30717,NA,"LFB","name ok","","Miconia corallina","NATIVA","Endemica/Cerrado-Endemica/Mata Atlântica","BR-RJ-BR-SP-BR-MG","Árvore","Cerrado (lato sensu)-Floresta Ciliar ou Galeria","Terrícola"
"387","Melastomataceae","Miconia cubatanensis Hoehne","Miconia cubatanensis Hoehne",9691,"Melastomataceae","Miconia cubatanensis Hoehne",9691,NA,"LFB","name ok","","Miconia cubatanensis","NATIVA","Endemica/Cerrado-Endemica/Mata Atlântica","BR-SP-BR-RJ-BR-MG-BR-ES-BR-SC-BR-PR-BR-BA-BR-DF","Árvore","Cerrado (lato sensu)-Floresta Ciliar ou Galeria-Floresta Ombrófila (= Floresta Pluvial)","Terrícola"
"388","Melastomataceae","Miconia discolor DC.","Miconia discolor DC.",9696,"Melastomataceae","Miconia discolor DC.",9696,NA,"LFB","name ok","","Miconia discolor","NATIVA","Não endemica/Mata Atlântica","BR-SP-BR-RJ-BR-MG-BR-ES-BR-SC-BR-PR-BR-MS","Árvore","Floresta Estacional Semidecidual-Floresta Ombrófila (= Floresta Pluvial)","Terrícola"
"389","Melastomataceae","Miconia elegans Cogn.","Miconia elegans Cogn.",9702,"Melastomataceae","Miconia elegans Cogn.",9702,NA,"LFB","name ok","","Miconia elegans","NATIVA","Endemica/Amazônia-Endemica/Caatinga-Endemica/Cerrado-Endemica/Mata Atlântica","BR-SP-BR-MG-BR-BA-BR-TO-BR-RO-BR-PA-BR-MT-BR-MS-BR-GO-BR-DF","Arbusto-Árvore","Floresta Ciliar ou Galeria-Floresta Ombrófila (= Floresta Pluvial)","Terrícola"
"390","Melastomataceae","Miconia flammea Casar.","Miconia flammea Casar.",9704,"Melastomataceae","Miconia flammea Casar.",9704,NA,"LFB","name ok","","Miconia flammea","NATIVA","Endemica/Cerrado-Endemica/Mata Atlântica","BR-PR-BR-SC-BR-ES-BR-SP-BR-RJ-BR-GO-BR-DF-BR-BA-BR-MG","Árvore","Floresta Estacional Semidecidual-Floresta Ombrófila (= Floresta Pluvial)-Vegetação Sobre Afloramentos Rochosos","Terrícola"
"391","Melastomataceae","Miconia hirtella Cogn.","Miconia hirtella Cogn.",9710,"Melastomataceae","Miconia hirtella Cogn.",9710,NA,"LFB","name ok","","Miconia hirtella","NATIVA","Endemica/Caatinga-Endemica/Cerrado-Endemica/Mata Atlântica","BR-MG-BR-ES-BR-BA-BR-GO-BR-DF","Arbusto-Árvore","Floresta Ciliar ou Galeria-Floresta Ombrófila (= Floresta Pluvial)","Terrícola"
"392","Melastomataceae","Miconia hyemalis A. St.-Hil. & Naud. ex Naud.","Miconia hyemalis A.St.-Hil. & Naudin",9712,"Melastomataceae","Miconia hyemalis A.St.-Hil. & Naudin",9712,NA,"LFB","name ok","","Miconia hyemalis","NATIVA","Não endemica/Cerrado-Não endemica/Mata Atlântica","BR-SP-BR-RJ-BR-MG-BR-SC-BR-RS-BR-PR","Arbusto-Árvore","Cerrado (lato sensu)-Floresta Ombrófila Mista","Terrícola"
"393","Melastomataceae","Miconia inconspicua Miq.","Miconia inconspicua Miq.",9716,"Melastomataceae","Miconia inconspicua Miq.",9716,NA,"LFB","name ok","","Miconia inconspicua","NATIVA","Endemica/Mata Atlântica","BR-SP-BR-RJ-BR-MG-BR-SC-BR-PR","Arbusto-Árvore","Floresta Estacional Semidecidual-Floresta Ombrófila (= Floresta Pluvial)-Floresta Ombrófila Mista","Terrícola"
"394","Melastomataceae","Miconia jucunda (DC.) Triana","Miconia jucunda (DC.) Triana",9717,"Melastomataceae","Miconia jucunda (DC.) Triana",9717,NA,"LFB","name ok","","Miconia jucunda","NATIVA","Não endemica/Cerrado-Não endemica/Mata Atlântica","BR-SP-BR-RJ-BR-MG-BR-ES-BR-SC-BR-PR-BR-BA-BR-MS","Arbusto-Árvore","Floresta Ciliar ou Galeria-Floresta Ombrófila (= Floresta Pluvial)","Terrícola"
"395","Melastomataceae","Miconia latecrenata (DC.) Naud.","Miconia latecrenata (DC.) Naudin",9724,"Melastomataceae","Miconia latecrenata (DC.) Naudin",9724,NA,"LFB","name ok","","Miconia latecrenata","NATIVA","Endemica/Mata Atlântica","BR-SP-BR-RJ-BR-MG-BR-ES-BR-SC-BR-RS-BR-PR-BR-PE-BR-BA","Arbusto-Árvore","Floresta Ombrófila (= Floresta Pluvial)","Terrícola"
