"63","Mimosa gemmulata",1090850089,-16.598528,-42.929889,"gass84","68c90cbc-e74b-4fb6-8ee4-6fa3bd247837","fe647d6c-1c4b-441b-b93b-d310d074b227","none","b38ff2b7-c8af-454e-b5af-ee760f0d5bca","BR","DWC_ARCHIVE","2018-11-23T15:39:53.892+0000","2018-11-23T15:39:53.909+0000",124,"none","PRESERVED_SPECIMEN",7224648,6,7707728,220,1370,5386,2969235,2969768,7224648,"Mimosa gemmulata var. gemmulata","Mimosa gemmulata var. gemmulata","Plantae","Tracheophyta","Fabales","Fabaceae","Mimosa","Mimosa gemmulata","Mimosa","gemmulata","VARIETY","ACCEPTED","2008-03-04T00:00:00",NA,NA,"Minas Gerais",2008,3,4,"2008-03-04T00:00:00","2018-11-13T17:52:18.000+0000","2018-12-09T06:14:47.739+0000","http://creativecommons.org/licenses/by-nc/4.0/legalcode","none","none","none","WGS84","Magnoliopsida","BR","Brazil","VIC - Herbário da Universidade Federal de Viçosa","BRA:UFV:VIC:0000035059","495","VIC - Herbário da Universidade Federal de Viçosa","Grão Mogol","Estrada Francisco Sá - Grão Mogol, Cerrado.","pt","VIC",1090850089,"BRA:UFV:VIC:0000035059","Collection","Dutra, V.F.; Fernandes, J.M.","35059","UFV","Universidade Federal de Viçosa (UFV)","Arbusto, c.a. de 2,5 metros de altura. Filetes rosa. Frutos jovens verdes, maduros castanhos. Muito frequente no local.","","Dutra, V.F.",NA,"","gemmulata","","","","","","",NA,"",NA,"","","",NA,"","",NA,"","","","","",NA,"","","","",NA,"","","",NA,"",NA,"Grão Mogol","Minas Gerais","brazil",2991,"Grão Mogol",3127800,-42.993475,-16.465094,"MINAS GERAIS","MG","Minas Gerais",-44.67333254,-18.45539008,"Minas Gerais","mg",-16.598528,-42.929889,"original coordinates","original coordinates OK"
"64","Mimosa gemmulata",1090851866,-14.869139,-43.034694,"gass84","68c90cbc-e74b-4fb6-8ee4-6fa3bd247837","fe647d6c-1c4b-441b-b93b-d310d074b227","none","b38ff2b7-c8af-454e-b5af-ee760f0d5bca","BR","DWC_ARCHIVE","2018-11-23T15:39:55.480+0000","2018-11-23T15:39:55.722+0000",124,"none","PRESERVED_SPECIMEN",7224648,6,7707728,220,1370,5386,2969235,2969768,7224648,"Mimosa gemmulata var. gemmulata","Mimosa gemmulata var. gemmulata","Plantae","Tracheophyta","Fabales","Fabaceae","Mimosa","Mimosa gemmulata","Mimosa","gemmulata","VARIETY","ACCEPTED","2008-02-05T00:00:00",NA,NA,"Minas Gerais",2008,3,9,"2008-03-09T00:00:00","2018-11-13T17:52:18.000+0000","2018-12-09T06:14:48.308+0000","http://creativecommons.org/licenses/by-nc/4.0/legalcode","none","none","none","WGS84","Magnoliopsida","BR","Brazil","VIC - Herbário da Universidade Federal de Viçosa","BRA:UFV:VIC:0000037722","542","VIC - Herbário da Universidade Federal de Viçosa","Mamonas","Parque Estadual Caminhos dos Gerais, Lapa. Campo Rupestre.","pt","VIC",1090851866,"BRA:UFV:VIC:0000037722","Collection","Dutra, V.F.; Fernandes, J.M.","37722","UFV","Universidade Federal de Viçosa (UFV)","Arbusto, c.a. de 2,0 metros. Filetes rosa. Muito frequente na área.","","Dutra, V.F.",NA,"","gemmulata","","","","","","",NA,"",NA,"","","",NA,"","",NA,"","","","","",NA,"","","","",NA,"","","",NA,"",NA,"Mamonas","Minas Gerais","brazil",3212,"Mamonas",3139250,-42.955142,-15.014703,"MINAS GERAIS","MG","Minas Gerais",-44.67333254,-18.45539008,"Minas Gerais","mg",-14.869139,-43.034694,"original coordinates","original coordinates outside municipality original in mamonas falls in espinosa"
"65","Mimosa gemmulata",1094857801,-13.583333,-41.966667,"gass84,iddatunl","2e684fd6-09e2-4661-910a-0a188b610c04","60545be9-4f28-4245-b4b4-07635c8dfa54","none","b38ff2b7-c8af-454e-b5af-ee760f0d5bca","BR","DWC_ARCHIVE","2018-11-14T17:19:16.247+0000","2018-11-14T17:19:16.286+0000",124,"none","PRESERVED_SPECIMEN",2969769,6,7707728,220,1370,5386,2969235,2969768,2969769,"Mimosa gemmulata var. adamantina Barneby","Mimosa gemmulata var. adamantina Barneby","Plantae","Tracheophyta","Fabales","Fabaceae","Mimosa","Mimosa gemmulata","Mimosa","gemmulata","VARIETY","ACCEPTED","2011-03-01T00:00:00",NA,NA,"Bahia",2008,3,18,"2008-03-18T00:00:00","","2018-11-14T17:19:16.321+0000","http://creativecommons.org/licenses/by-nc/4.0/legalcode","none","none","none","WGS84","Magnoliopsida","BR","Brazil","HUEFS - Herbario da Universidade Estadual de Feira de Santana","BRA:UEFS:HUEFS:0000140446","656","HUEFS - Herbario da Universidade Estadual de Feira de Santana","Rio de Contas","Estrada para Serra das Almas.","pt","HUEFS",1094857801,"BRA:UEFS:HUEFS:0000140446","Collection","Conceição, S.F.","140446","UEFS","Universidade Estadual de Feira de Santana (UEFS)","","","J.S.Silva",NA,"","adamantina","","","","","","",NA,"",NA,"","","",NA,"","",NA,"","","","","",NA,"","","","",NA,"","","",NA,"",NA,"Rio de Contas","Bahia","brazil",3389,"Rio de Contas",2926707,-41.741571,-13.586451,"BAHIA","BA","Bahia",-41.72018023,-12.47295682,"Bahia","ba",-13.583333,-41.966667,"original coordinates","original coordinates outside municipality original in rio de contas falls in livramento de nossa senhora"
"66","Mimosa gemmulata",1077229120,-14.363611,-42.536944,"gass84","5b5cf455-a448-4c0a-aecd-3e0956f27f10","afdd8e93-b4e3-491c-88f0-8a22834ac1a9","none","b38ff2b7-c8af-454e-b5af-ee760f0d5bca","BR","DWC_ARCHIVE","2018-12-03T14:13:38.936+0000","2018-12-03T16:16:19.428+0000",122,"none","PRESERVED_SPECIMEN",2969768,6,7707728,220,1370,5386,2969235,2969768,2969768,"Mimosa gemmulata Barneby","Mimosa gemmulata Barneby","Plantae","Tracheophyta","Fabales","Fabaceae","Mimosa","Mimosa gemmulata","Mimosa","gemmulata","SPECIES","ACCEPTED","2008-07-01T00:00:00",NA,NA,"Bahia",2008,5,22,"2008-05-22T00:00:00","2018-08-28T19:07:06.000+0000","2018-12-06T14:16:33.831+0000","http://creativecommons.org/licenses/by-nc/4.0/legalcode","none","none","none","WGS84","Magnoliopsida","BR","Brazil","ALCB - Herbário Alexandre Leal Costa","BRA:UFBA:ALCB:0000083840","14444","ALCB - Herbário Alexandre Leal Costa","Caetité","Serra Geral, Brejinho das ametistas, Bloco III área 2","pt","ALCB",1077229120,"BRA:UFBA:ALCB:0000083840","Collection","Guedes, ML; Gomes, FS","83840","Universidade Federal da Bahia (UFBA)","Universidade Federal da Bahia (UFBA)","de ca 2 m de altura. Material estéril.","SOUTH_AMERICA","Guedes, ML; Queiroz, LP de",NA,"","","","","","","","",NA,"",NA,"","","",NA,"","",NA,"","","","","",NA,"","","","",NA,"","","",NA,"",NA,"Caetité","Bahia","brazil",3351,"Caetité",2905206,-42.492478,-13.971521,"BAHIA","BA","Bahia",-41.72018023,-12.47295682,"Bahia","ba",-14.363611,-42.536944,"original coordinates","original coordinates OK"
"67","Mimosa gemmulata",1090849384,-17.472639,-43.081194,"gass84","68c90cbc-e74b-4fb6-8ee4-6fa3bd247837","fe647d6c-1c4b-441b-b93b-d310d074b227","none","b38ff2b7-c8af-454e-b5af-ee760f0d5bca","BR","DWC_ARCHIVE","2018-11-23T15:39:52.963+0000","2018-11-23T15:39:52.975+0000",124,"none","PRESERVED_SPECIMEN",2969768,6,7707728,220,1370,5386,2969235,2969768,2969768,"Mimosa gemmulata Barneby","Mimosa gemmulata Barneby","Plantae","Tracheophyta","Fabales","Fabaceae","Mimosa","Mimosa gemmulata","Mimosa","gemmulata","SPECIES","ACCEPTED","2008-05-28T00:00:00",NA,NA,"Minas Gerais",2008,5,28,"2008-05-28T00:00:00","2018-11-13T17:52:18.000+0000","2018-12-09T06:14:47.421+0000","http://creativecommons.org/licenses/by-nc/4.0/legalcode","none","none","none","WGS84","Magnoliopsida","BR","Brazil","VIC - Herbário da Universidade Federal de Viçosa","BRA:UFV:VIC:0000033521","2281","VIC - Herbário da Universidade Federal de Viçosa","Carbonita","Acelor Mittal Florestas Ltda, Estiva; Centro de Educação Ambiental (CEAM); Cerrado Rupestre.","pt","VIC",1090849384,"BRA:UFV:VIC:0000033521","Collection","Valente, G.E.; et al.","33521","UFV","Universidade Federal de Viçosa (UFV)","Planta ca. 1,5m na borda da estrada na mão de saída da sede do CEAM. Inflorescência rosa.","","Valente, G.E.",NA,"","","","","","","","",NA,"",NA,"","","",NA,"","",NA,"","","","","",NA,"","","","",NA,"","","",NA,"",NA,"Carbonita","Minas Gerais","brazil",2845,"Carbonita",3113503,-43.058491,-17.494668,"MINAS GERAIS","MG","Minas Gerais",-44.67333254,-18.45539008,"Minas Gerais","mg",-17.472639,-43.081194,"original coordinates","original coordinates OK"
"68","Mimosa gemmulata",1090849378,-17.472639,-43.081194,"gass84","68c90cbc-e74b-4fb6-8ee4-6fa3bd247837","fe647d6c-1c4b-441b-b93b-d310d074b227","none","b38ff2b7-c8af-454e-b5af-ee760f0d5bca","BR","DWC_ARCHIVE","2018-11-23T15:39:52.966+0000","2018-11-23T15:39:52.981+0000",124,"none","PRESERVED_SPECIMEN",2969768,6,7707728,220,1370,5386,2969235,2969768,2969768,"Mimosa gemmulata Barneby","Mimosa gemmulata Barneby","Plantae","Tracheophyta","Fabales","Fabaceae","Mimosa","Mimosa gemmulata","Mimosa","gemmulata","SPECIES","ACCEPTED","2008-05-28T00:00:00",NA,NA,"Minas Gerais",2008,5,28,"2008-05-28T00:00:00","2018-11-13T17:52:18.000+0000","2018-12-09T06:14:47.436+0000","http://creativecommons.org/licenses/by-nc/4.0/legalcode","none","none","none","WGS84","Magnoliopsida","BR","Brazil","VIC - Herbário da Universidade Federal de Viçosa","BRA:UFV:VIC:0000033522","2282","VIC - Herbário da Universidade Federal de Viçosa","Carbonita","Acelor Mittal Florestas Ltda, Estiva; Centro de Educação Ambiental (CEAM); Cerrado Rupestre.","pt","VIC",1090849378,"BRA:UFV:VIC:0000033522","Collection","Valente, G.E.; et al.","33522","UFV","Universidade Federal de Viçosa (UFV)","Planta ca. 1m, em frente ao pomar de Citrus da sede do CEAM. Inflorescência rosa.","","Valente, G.E.",NA,"","","","","","","","",NA,"",NA,"","","",NA,"","",NA,"","","","","",NA,"","","","",NA,"","","",NA,"",NA,"Carbonita","Minas Gerais","brazil",2845,"Carbonita",3113503,-43.058491,-17.494668,"MINAS GERAIS","MG","Minas Gerais",-44.67333254,-18.45539008,"Minas Gerais","mg",-17.472639,-43.081194,"original coordinates","original coordinates OK"
"69","Mimosa gemmulata",1077229138,-14.344167,-42.537778,"gass84","5b5cf455-a448-4c0a-aecd-3e0956f27f10","afdd8e93-b4e3-491c-88f0-8a22834ac1a9","none","b38ff2b7-c8af-454e-b5af-ee760f0d5bca","BR","DWC_ARCHIVE","2018-12-03T14:13:39.084+0000","2018-12-03T16:16:19.433+0000",122,"none","PRESERVED_SPECIMEN",2969768,6,7707728,220,1370,5386,2969235,2969768,2969768,"Mimosa gemmulata Barneby","Mimosa gemmulata Barneby","Plantae","Tracheophyta","Fabales","Fabaceae","Mimosa","Mimosa gemmulata","Mimosa","gemmulata","SPECIES","ACCEPTED","2008-07-01T00:00:00",1069,0,"Bahia",2008,5,22,"2008-05-22T00:00:00","2018-08-28T19:07:06.000+0000","2018-12-06T14:16:33.855+0000","http://creativecommons.org/licenses/by-nc/4.0/legalcode","none","none","none","WGS84","Magnoliopsida","BR","Brazil","ALCB - Herbário Alexandre Leal Costa","BRA:UFBA:ALCB:0000083829","14433","ALCB - Herbário Alexandre Leal Costa","Caetité","Serra Geral, Brejinho das Ametistas, caminho para o Bloco III","pt","ALCB",1077229138,"BRA:UFBA:ALCB:0000083829","Collection","Guedes, ML; Gomes, FS","83829","Universidade Federal da Bahia (UFBA)","Universidade Federal da Bahia (UFBA)","de ca 2,5 m de altura. Folhas com foliólulos membranáceos, pequenos. Inflorescência em espigas , flores passadas. Frutos imaturos verdes.","SOUTH_AMERICA","Queiroz, LP de",NA,"","","","","","","","",NA,"",NA,"","","",NA,"","",NA,"","","","","",NA,"","","","",NA,"","","",NA,"",NA,"Caetité","Bahia","brazil",3351,"Caetité",2905206,-42.492478,-13.971521,"BAHIA","BA","Bahia",-41.72018023,-12.47295682,"Bahia","ba",-14.344167,-42.537778,"original coordinates","original coordinates OK"
"70","Mimosa gemmulata",1090849373,-17.425056,-43.091444,"gass84","68c90cbc-e74b-4fb6-8ee4-6fa3bd247837","fe647d6c-1c4b-441b-b93b-d310d074b227","none","b38ff2b7-c8af-454e-b5af-ee760f0d5bca","BR","DWC_ARCHIVE","2018-11-23T15:39:52.965+0000","2018-11-23T15:39:52.977+0000",124,"none","PRESERVED_SPECIMEN",2969768,6,7707728,220,1370,5386,2969235,2969768,2969768,"Mimosa gemmulata Barneby","Mimosa gemmulata Barneby","Plantae","Tracheophyta","Fabales","Fabaceae","Mimosa","Mimosa gemmulata","Mimosa","gemmulata","SPECIES","ACCEPTED","2008-06-01T00:00:00",NA,NA,"Minas Gerais",2008,6,1,"2008-06-01T00:00:00","2018-11-13T17:52:18.000+0000","2018-12-09T06:14:47.358+0000","http://creativecommons.org/licenses/by-nc/4.0/legalcode","none","none","none","WGS84","Magnoliopsida","BR","Brazil","VIC - Herbário da Universidade Federal de Viçosa","BRA:UFV:VIC:0000033523","2345","VIC - Herbário da Universidade Federal de Viçosa","Carbonita","Acelor Mittal Florestas Ltda, Estiva; Talhão n° 114 (T-114) de eucalipto.","pt","VIC",1090849373,"BRA:UFV:VIC:0000033523","Collection","Valente, G.E.; et al.","33523","UFV","Universidade Federal de Viçosa (UFV)","Planta ca. 1m de altura, em frente ao Talhão n° 114 de eucalipto. Inflorescência rosa.","","Valente, G.E.",NA,"","","","","","","","",NA,"",NA,"","","",NA,"","",NA,"","","","","",NA,"","","","",NA,"","","",NA,"",NA,"Carbonita","Minas Gerais","brazil",2845,"Carbonita",3113503,-43.058491,-17.494668,"MINAS GERAIS","MG","Minas Gerais",-44.67333254,-18.45539008,"Minas Gerais","mg",-17.425056,-43.091444,"original coordinates","original coordinates OK"
"71","Mimosa gemmulata",1265929730,-14.323333,-42.556944,"gass84,iddatunl","d2470ef8-edfa-4ba7-821e-c3e1a537bdba","4265f332-341c-45f6-b30b-5dc2e39b86e8","none","b38ff2b7-c8af-454e-b5af-ee760f0d5bca","BR","DWC_ARCHIVE","2018-11-14T17:11:36.916+0000","2018-02-15T05:17:38.740+0000",121,"none","PRESERVED_SPECIMEN",2969768,6,7707728,220,1370,5386,2969235,2969768,2969768,"Mimosa gemmulata Barneby","Mimosa gemmulata Barneby","Plantae","Tracheophyta","Fabales","Fabaceae","Mimosa","Mimosa gemmulata","Mimosa","gemmulata","SPECIES","ACCEPTED","2010-11-01T00:00:00",980,0,"Bahia",2008,8,NA,"2008-08-01T00:00:00","","2018-07-07T10:15:50.720+0000","http://creativecommons.org/licenses/by-nc/4.0/legalcode","none","none","none","WGS84","Magnoliopsida","BR","Brazil","BHCB - Herbário da Universidade Federal de Minas Gerais","BRA:UFMG:BHCB:0000127971","422","BHCB - Herbário da Universidade Federal de Minas Gerais","Caetité","Região de Brejinho das Ametistas, Área da Bahia Mineração","pt","BHCB",1265929730,"BRA:UFMG:BHCB:0000127971","Collection","Mendes, MS; Brina, AE; Ranieri, BD; et al.","127971","Universidade Federal de Minas Gerais (UFMG)","Universidade Federal de Minas Gerais (UFMG)","","SOUTH_AMERICA","",NA,"","","","","","","","",NA,"",NA,"","","",NA,"","",NA,"","","","","",NA,"","","","",NA,"","","",NA,"",NA,"Caetité","Bahia","brazil",3351,"Caetité",2905206,-42.492478,-13.971521,"BAHIA","BA","Bahia",-41.72018023,-12.47295682,"Bahia","ba",-14.323333,-42.556944,"original coordinates","original coordinates OK"
"72","Mimosa gemmulata",1587328806,-15.953055,-42.453611,"gass84","e38d4c95-3a1d-4594-9ae9-883b48042e6d","7ef169f9-81f8-46a2-a7f7-240df6a1889c","none","b38ff2b7-c8af-454e-b5af-ee760f0d5bca","BR","DWC_ARCHIVE","2018-11-23T18:21:40.739+0000","2018-11-23T18:21:40.812+0000",123,"none","PRESERVED_SPECIMEN",7224648,6,7707728,220,1370,5386,2969235,2969768,7224648,"Mimosa gemmulata var. gemmulata","Mimosa gemmulata var. gemmulata","Plantae","Tracheophyta","Fabales","Fabaceae","Mimosa","Mimosa gemmulata","Mimosa","gemmulata","VARIETY","ACCEPTED","none",994,0,"Minas Gerais",2008,12,11,"2008-12-11T00:00:00","","2018-11-23T18:22:58.111+0000","http://creativecommons.org/licenses/by-nc/4.0/legalcode","none","none","none","WGS84","Magnoliopsida","BR","Brazil","CEN - Herbário da Embrapa Recursos Genéticos e Biotecnologia","BRA:Cenargen:CEN:0000097285","5032","CEN - Herbário da Embrapa Recursos Genéticos e Biotecnologia","RIO PARDO DE MINAS","Vereda Funda. Ponto 06 - Cabeceira Mata dos Cavalos.","pt","CEN",1587328806,"BRA:Cenargen:CEN:0000097285","Collection","Anderson Cássio Sevilha","97285","Cenargen","Empresa Brasileira de Pesquisa Agropecuária (EMBRAPA)","","","M. Simon",4,"Exsicatas","gemmulata","","","","","","",NA,"",NA,"","","",NA,"","",NA,"","","","","",NA,"","","","",NA,"","","",NA,"",NA,"RIO PARDO DE MINAS","Minas Gerais","brazil",3112,"Rio Pardo de Minas",3155603,-42.551348,-15.709272,"MINAS GERAIS","MG","Minas Gerais",-44.67333254,-18.45539008,"Minas Gerais","mg",-15.953055,-42.453611,"original coordinates","original coordinates OK"
"73","Mimosa gemmulata",1094902088,-15.161111,-43.045,"gass84,iddatunl","2e684fd6-09e2-4661-910a-0a188b610c04","60545be9-4f28-4245-b4b4-07635c8dfa54","none","b38ff2b7-c8af-454e-b5af-ee760f0d5bca","BR","DWC_ARCHIVE","2018-11-14T17:19:44.109+0000","2018-11-14T17:19:44.119+0000",124,"none","PRESERVED_SPECIMEN",2969769,6,7707728,220,1370,5386,2969235,2969768,2969769,"Mimosa gemmulata var. adamantina Barneby","Mimosa gemmulata var. adamantina Barneby","Plantae","Tracheophyta","Fabales","Fabaceae","Mimosa","Mimosa gemmulata","Mimosa","gemmulata","VARIETY","ACCEPTED","2012-09-01T00:00:00",1100,0,"Minas Gerais",2008,12,15,"2008-12-15T00:00:00","","2018-11-14T17:19:44.127+0000","http://creativecommons.org/licenses/by-nc/4.0/legalcode","none","none","none","WGS84","Magnoliopsida","BR","Brazil","HUEFS - Herbario da Universidade Estadual de Feira de Santana","BRA:UEFS:HUEFS:0000185048","81","HUEFS - Herbario da Universidade Estadual de Feira de Santana","Monte Azul","Parque Estadual Caminho dos Gerais, Arredores do córrego de Barrinhas.","pt","HUEFS",1094902088,"BRA:UEFS:HUEFS:0000185048","Collection","Perillo, L.N.","185048","UEFS","Universidade Estadual de Feira de Santana (UEFS)","Cerrado.","","L.P.de Queiroz",NA,"","adamantina","","","","","","",NA,"",NA,"","","",NA,"","",NA,"","","","","",NA,"","","","",NA,"","","",NA,"",NA,"Monte Azul","Minas Gerais","brazil",3187,"Monte Azul",3142908,-42.969276,-15.207587,"MINAS GERAIS","MG","Minas Gerais",-44.67333254,-18.45539008,"Minas Gerais","mg",-15.161111,-43.045,"original coordinates","original coordinates outside municipality original in monte azul falls in gameleiras"
"74","Mimosa gemmulata",1094910734,-19.005,-43.768333,"gass84,iddatunl","2e684fd6-09e2-4661-910a-0a188b610c04","60545be9-4f28-4245-b4b4-07635c8dfa54","none","b38ff2b7-c8af-454e-b5af-ee760f0d5bca","BR","DWC_ARCHIVE","2018-11-14T17:19:47.588+0000","2018-11-14T17:19:47.619+0000",124,"none","PRESERVED_SPECIMEN",7224648,6,7707728,220,1370,5386,2969235,2969768,7224648,"Mimosa gemmulata var. gemmulata","Mimosa gemmulata var. gemmulata","Plantae","Tracheophyta","Fabales","Fabaceae","Mimosa","Mimosa gemmulata","Mimosa","gemmulata","VARIETY","ACCEPTED","2014-12-01T00:00:00",683,0,"Minas Gerais",2007,2,15,"2007-02-15T00:00:00","","2018-11-14T17:19:47.676+0000","http://creativecommons.org/licenses/by-nc/4.0/legalcode","none","none","none","WGS84","Magnoliopsida","BR","Brazil","HUEFS - Herbario da Universidade Estadual de Feira de Santana","BRA:UEFS:HUEFS:0000194068","722","HUEFS - Herbario da Universidade Estadual de Feira de Santana","Santana do Pirapama","Serra do Cipó, Fazenda Toucan Cipó, estrada para captação.","pt","HUEFS",1094910734,"BRA:UEFS:HUEFS:0000194068","Collection","Zappi, D.C.","194068","UEFS","Universidade Estadual de Feira de Santana (UEFS)","Cerrado arbustivo - arbóreo denso, sobre solo arenoso.","","L.P.Queiroz",NA,"","gemmulata","","","","","","",NA,"",NA,"","","",NA,"","",NA,"","","","","",NA,"","","","",NA,"","","",NA,"",NA,"Santana do Pirapama","Minas Gerais","brazil",NA,"",NA,NA,NA,"","","Minas Gerais",-44.67333254,-18.45539008,"Minas Gerais","mg",-19.005,-43.768333,"original coordinates","original coordinates outside municipality original in santana do pirapama falls in santana de pirapama"
"75","Mimosa gemmulata",1563167084,-19.006111,-43.755556,"gass84","1bb3cae3-b91f-4109-8a2d-a1f05f2d6fd3","76dbcb10-efc5-4d5f-87a5-bcd409fc92c8","none","b38ff2b7-c8af-454e-b5af-ee760f0d5bca","BR","DWC_ARCHIVE","2018-11-24T12:30:44.829+0000","2018-09-25T14:05:26.617+0000",126,"none","PRESERVED_SPECIMEN",2969768,6,7707728,220,1370,5386,2969235,2969768,2969768,"Mimosa gemmulata Barneby","Mimosa gemmulata Barneby","Plantae","Tracheophyta","Fabales","Fabaceae","Mimosa","Mimosa gemmulata","Mimosa","gemmulata","SPECIES","ACCEPTED","2008-01-01T00:00:00",NA,NA,"Minas Gerais",2007,2,19,"2007-02-19T00:00:00","2018-08-21T18:32:52.000+0000","2018-12-07T14:50:37.435+0000","http://creativecommons.org/licenses/by-nc/4.0/legalcode","none","none","none","WGS84","Magnoliopsida","BR","Brazil","SPF - Herbário da Universidade de São Paulo","BRA:USP:SPF:0000182562","32750","SPF - Herbário da Universidade de São Paulo","Santana de Pirapama","Serra do Cipó","pt","SPF",1563167084,"BRA:USP:SPF:0000182562","Collection","Souza, VC","182562","USP","Universidade de São Paulo, USP","","","Borges, LM",NA,"","","","","","","","",NA,"",NA,"","","",NA,"","",NA,"","","","","",NA,"","","","",NA,"","","",NA,"",NA,"Santana de Pirapama","Minas Gerais","brazil",2648,"Santana de Pirapama",3158508,-43.904348,-18.918993,"MINAS GERAIS","MG","Minas Gerais",-44.67333254,-18.45539008,"Minas Gerais","mg",-19.006111,-43.755556,"original coordinates","original coordinates OK"
"76","Mimosa gemmulata",1135816531,-18.082,-43.346917,"gass84","1bb3cae3-b91f-4109-8a2d-a1f05f2d6fd3","76dbcb10-efc5-4d5f-87a5-bcd409fc92c8","none","b38ff2b7-c8af-454e-b5af-ee760f0d5bca","BR","DWC_ARCHIVE","2018-11-24T12:30:51.463+0000","2018-09-25T14:05:47.325+0000",126,"none","PRESERVED_SPECIMEN",7224648,6,7707728,220,1370,5386,2969235,2969768,7224648,"Mimosa gemmulata var. gemmulata","Mimosa gemmulata var. gemmulata","Plantae","Tracheophyta","Fabales","Fabaceae","Mimosa","Mimosa gemmulata","Mimosa","gemmulata","VARIETY","ACCEPTED","2008-04-01T00:00:00",882,0,"Minas Gerais",2007,3,7,"2007-03-07T00:00:00","2018-08-21T18:32:52.000+0000","2018-12-06T21:47:00.607+0000","http://creativecommons.org/licenses/by-nc/4.0/legalcode","none","none","none","WGS84","Magnoliopsida","BR","Brazil","SPF - Herbário da Universidade de São Paulo","BRA:USP:SPF:0000214341","311","SPF - Herbário da Universidade de São Paulo","São Gonçalo do Rio Preto","Parque Estadual do Rio Preto","pt","SPF",1135816531,"BRA:USP:SPF:0000214341","Collection","Dutra, VF","214341","USP","Universidade de São Paulo, USP","","","Dutra, VF",NA,"","gemmulata","","","","","","",NA,"",NA,"","","",NA,"","",NA,"","","","","",NA,"","","","",NA,"","","",NA,"",NA,"São Gonçalo do Rio Preto","Minas Gerais","brazil",2789,"São Gonçalo do Rio Preto",3125507,-43.359005,-18.0765,"MINAS GERAIS","MG","Minas Gerais",-44.67333254,-18.45539008,"Minas Gerais","mg",-18.082,-43.346917,"original coordinates","original coordinates OK"
"77","Mimosa gemmulata",1090850096,-18.082,-43.346917,"gass84","68c90cbc-e74b-4fb6-8ee4-6fa3bd247837","fe647d6c-1c4b-441b-b93b-d310d074b227","none","b38ff2b7-c8af-454e-b5af-ee760f0d5bca","BR","DWC_ARCHIVE","2018-11-23T15:39:54.014+0000","2018-11-23T15:39:54.017+0000",124,"none","PRESERVED_SPECIMEN",7224648,6,7707728,220,1370,5386,2969235,2969768,7224648,"Mimosa gemmulata var. gemmulata","Mimosa gemmulata var. gemmulata","Plantae","Tracheophyta","Fabales","Fabaceae","Mimosa","Mimosa gemmulata","Mimosa","gemmulata","VARIETY","ACCEPTED","2007-04-03T00:00:00",NA,NA,"Minas Gerais",2007,3,7,"2007-03-07T00:00:00","2018-11-13T17:52:18.000+0000","2018-12-09T06:14:47.725+0000","http://creativecommons.org/licenses/by-nc/4.0/legalcode","none","none","none","WGS84","Magnoliopsida","BR","Brazil","VIC - Herbário da Universidade Federal de Viçosa","BRA:UFV:VIC:0000035047","331","VIC - Herbário da Universidade Federal de Viçosa","São Gonçalo do Rio Preto","Parque Estadual do Rio Preto (PERP), Trilha para portaria. Afloramento rochoso.","pt","VIC",1090850096,"BRA:UFV:VIC:0000035047","Collection","Dutra, V.F.","35047","UFV","Universidade Federal de Viçosa (UFV)","Arbusto, c.a. de 2,0 metros de altura. Flores em espiga, corola rosa, filetes rosa escuro. Frutos maduros, castanhos. Muito frequente na área.","","Dutra, V.F.",NA,"","gemmulata","","","","","","",NA,"",NA,"","","",NA,"","",NA,"","","","","",NA,"","","","",NA,"","","",NA,"",NA,"São Gonçalo do Rio Preto","Minas Gerais","brazil",2789,"São Gonçalo do Rio Preto",3125507,-43.359005,-18.0765,"MINAS GERAIS","MG","Minas Gerais",-44.67333254,-18.45539008,"Minas Gerais","mg",-18.082,-43.346917,"original coordinates","original coordinates OK"
"78","Mimosa gemmulata",1094836066,-13.890833,-40.122222,"gass84,iddatunl","2e684fd6-09e2-4661-910a-0a188b610c04","60545be9-4f28-4245-b4b4-07635c8dfa54","none","b38ff2b7-c8af-454e-b5af-ee760f0d5bca","BR","DWC_ARCHIVE","2018-11-14T17:19:01.872+0000","2018-11-14T17:19:01.941+0000",124,"none","PRESERVED_SPECIMEN",2969768,6,7707728,220,1370,5386,2969235,2969768,2969768,"Mimosa gemmulata Barneby","Mimosa gemmulata Barneby","Plantae","Tracheophyta","Fabales","Fabaceae","Mimosa","Mimosa gemmulata","Mimosa","gemmulata","SPECIES","ACCEPTED","2013-05-01T00:00:00",671,0,"Bahia",2007,4,13,"2007-04-13T00:00:00","","2018-11-14T17:19:01.973+0000","http://creativecommons.org/licenses/by-nc/4.0/legalcode","none","none","none","WGS84","Magnoliopsida","BR","Brazil","HUEFS - Herbario da Universidade Estadual de Feira de Santana","BRA:UEFS:HUEFS:0000118509","13012","HUEFS - Herbario da Universidade Estadual de Feira de Santana","Jequié","Morro da Torre.","pt","HUEFS",1094836066,"BRA:UEFS:HUEFS:0000118509","Collection","Queiroz, L.P.de","118509","UEFS","Universidade Estadual de Feira de Santana (UEFS)","Floresta estacional com caatinga na base.","","J.S.Silva",NA,"","","","","","","","",NA,"",NA,"","","",NA,"","",NA,"","","","","",NA,"","","","",NA,"","","",NA,"",NA,"Jequié","Bahia","brazil",3357,"Jequié",2918001,-40.159646,-13.871669,"BAHIA","BA","Bahia",-41.72018023,-12.47295682,"Bahia","ba",-13.890833,-40.122222,"original coordinates","original coordinates OK"
